Identifier,Place of Publication,Date of Publication,Publisher,Title,Author
557691,Edinburgh,1850,A. Fullarton & Co.,"The Works of Lord Byron: with a life and illustrative notes, by William Anderson. [With plates, including a portrait.]: Works","Byron, George Gordon Byron - Baron"
557697,London,1859,John Murray,"The Poetical Works of Lord Byron. Collected and arranged with notes by Sir Walter Scott, Lord Jeffrey [and others] ... New and complete edition. With portrait and illustrative engravings: Works","Byron, George Gordon Byron - Baron"
557711,York,1869,D. Appleton & Co.,"The Poetical Works of Lord Byron. Complete in one volume. Collected and arranged, with illustrative notes by Thomas Moore, Lord Jeffrey [and others] ... With a portrait, etc: Works","Byron, George Gordon Byron - Baron"
557712,London,1870,"E. Moxon, Son & Co.","The Poetical Works of Lord Byron. Edited, with a critical memoir, by William Michael Rossetti. Illustrated by Ford Madox Brown: Works","Byron, George Gordon Byron - Baron"
557721,London,1881,,"[The Poetical Works of Lord Byron. Edited, with a critical memoir, by W. M. Rossetti. Illustrated by Thomas Seccombe [or rather, by Ford Madox Brown].]: Works","Byron, George Gordon Byron - Baron"
557730,London,1887,G. Routledge & Sons,The Complete Poetical Works of Lord Byron. With an introductory memoir by William B. Scott: Works,"Byron, George Gordon Byron - Baron|Byron, George Gordon Byron - Baron"
557755,Paris,1823,,"[Œuvres complètes de Lord Byron, traduites de l'anglais par MM. A.-P. et E.-D. S. [i.e. Amédée Pichot and Eusèbe de Salle]; troisième édition, entièrement revue et corrigée. (Essai sur le génie et le caractère de Lord Byron, par A. P .... t [i.e. A. Pichot]; précédé d'une notice préliminaire, par M. Charles Nodier. Extraits de la quatrième édition des Œuvres complètes de Lord Byron-six volumes in-8º, ornés de vignettes. [With an essay “Sur la mort de Lord Byron,” and a translation of his “Heaven and Earth.”]) [With a portrait.]]: Works. French","Byron, George Gordon Byron - Baron"
557756,Paris,1830,,"Œuvres complètes de Lord Byron, avec notes et commentaires, comprenant ses mémoires publiés par Thomas Moore, et ornées d'un beau portrait de l'auteur. Traduction nouvelle par M. Paulin Paris: Works. French","Byron, George Gordon Byron - Baron"
557757,Paris,1836,,"Œuvres complètes de Lord Byron, traduction nouvelle, d'après la dernière édition de Londres, par Benjamin Laroche ... Avec les notes et commentaires de Sir Walter Scott, Thomas Moore, Francis Jeffrey ... etc.; les variantes du texte; précédées de l'histoire de la vie et des ouvrages de Lord Byron, par John Galt. [With a portrait.]: Works. French","Byron, George Gordon Byron - Baron"
557758,Paris,1842,,"Œuvres complètes de Lord Byron. Traduction de M. Amédée Pichot. Onzième édition, accompagnée de notes historiques et littéraires. [With plates, including a portrait.]: Works. French","Byron, George Gordon Byron - Baron"
557759,Paris,1845,,"Œuvres de Lord Byron, traduites en vers français par Orby Hunter & Pascal Ramé: Works. French","Byron, George Gordon Byron - Baron"
557783,London,1816,W. Hone,"[Poems on his Domestic Circumstances. I. Fare Thee Well! II. A Sketch from Private Life. By Lord Byron. With the Star of the Legion of Honour, and other poems. [Seven poems, including two spurious.]]: Smaller Collections","Byron, George Gordon Byron - Baron"
557851,Halle,1886,,"Byron's Prisoner of Chillon und Siege of Corinth. Mit bibliographischem Material, litterarischer Einleitung und sachlichen Anmerkungen ... herausegegeben von J. G. C. Schuler: Smaller Collections","Byron, George Gordon Byron - Baron"
557933,Schwerin,1866,,"Byron-Anthologie. Auserwähltes aus Lord Byron's Dichtungen, übertragen von Eduard Hobein: Smaller Collections. German","Byron, George Gordon Byron - Baron"
557942,Milano,1834,,"Poemi di Giorgio Lord Byron, recati in italiano da Giuseppe Nicolini. [The Bride of Abydos, Parisina, The Corsair, Lara.] Con alcuni componimenti originali del traduttore: Smaller Collections. Italian","Byron, George Gordon Byron - Baron"
558071,Paris,1823,,"Caïn, mystère dramatique en trois actes ... traduit en vers français, et réfuté dans une suite de remarques philosophiques et critiques, précédé d'une lettre adressée à Lord Byron, sur les motifs et le but de cet ouvrage, par Fabre d'Olivet: Single Works. Cain. French","Byron, George Gordon Byron - Baron"
558105,Firenze,1872,,Italia. Canto ... tradotto da A. Maffei: Single Works. Childe Harold's Pilgrimage. Canto IV. Italian,"Byron, George Gordon Byron - Baron"
558131,Berlin,1854,,[Childe Harold's Pilgrimage. A romaunt. [With a portrait.]]: Single Works. Childe Harold's Pilgrimage. Cantos I-IV,"Byron, George Gordon Byron - Baron"
558153,Stuttgart,1836,,Ritter Harold's Pilgerfahrt ... Im Versmass des Originals übersetzt von Zedlitz: Single Works. Childe Harold's Pilgrimage. Cantos I-IV. German,"Byron, George Gordon Byron - Baron"
558159,Genfben,1857,,Childe Harold. Byron után anya nyelvéből magyarra forditotta Bickersteth Johanka: Single Works. Childe Harold's Pilgrimage. Cantos I-IV. Hungarian,"Byron, George Gordon Byron - Baron"
558185,Torino,1819,,"Il Corsaro, novella di Lord Byron; versione in prosa di L. C: Single Works. The Corsair. Italian","Byron, George Gordon Byron - Baron"
558263,v. Tarnopol,1863,,"Don Żuan Lorda Bajrona. Pieśń pierwsza, przełożna przez Wiktora z Baworowa: Single Works. Don Juan. Cantos I-XVI. Polish","Byron, George Gordon Byron - Baron"
558277,London,1845,Paget & Co.,[A Sequel to Don Juan. [By G. W. M. Reynolds.]]: Single Works. Don Juan. Spurious Cantos and Imitations,"Byron, George Gordon Byron - Baron"
558284,London,1809,James Cawthorn,"Second edition, with considerable additions and alterations: Single Works. English Bards, and Scotch Reviewers. Enlarged Version. Second Edition","Byron, George Gordon Byron - Baron"
558328,London,1886,Printed for private circulation,A fac-simile reprint of the suppressed edition of 1806. [Edited by H. Buxston Forman.]: Single Works. Fugitive Pieces,"Byron, George Gordon Byron - Baron"
558361,London,1815,John Murray,Hebrew Melodies: Single Works. Hebrew Melodies,"Byron, George Gordon Byron - Baron"
558397,Pisa,1818,,Lamento del Tasso ... Recato in italiano da M. Leoni: Single Works. The Lament of Tasso. English and Italian,"Byron, George Gordon Byron - Baron"
558442,Bruxelles,1852,,"Manfred, poëme dramatique ... Traduit par Madame la comtesse de Lalaing ... Seconde édition: Single Works. Manfred. French","Byron, George Gordon Byron - Baron"
558451,ἐν Πατραις,1864,,Ὁ Μαμφρεδ. Δραματικον ποιημα ... Μεταφρασις Ἐ. Γκρην: Single Works. Manfred. Greek. Modern Greek,"Byron, George Gordon Byron - Baron"
558479,Shanklin,1896,Silsbury Bros.,The Knight's Tour in a continuous and uninterrupted ride over 48 boards or 3072 squares. Adapted from Byron's “Mazeppa” by H. Eschwege: Single Works. Mazeppa,"Byron, George Gordon Byron - Baron"
558519,London,1865,Day & Son,"[The prisoner of Chillon, and other poems.]: Single Works. The Prisoner of Chillon","Byron, George Gordon Byron - Baron|Byron, George Gordon Byron - Baron"
558562,Warszawa,1872,,Sardanapal ... Przekład Fryderyka Krauze'go. Wydanie redakcyi Biblioteki Warszawskiéj: Single Works. Sardanapalus. Polish,"Byron, George Gordon Byron - Baron"
558609,Novi,1870,,"A' miei amici. [Extracts from Childe Harold and The Corsair, and The Tear, translated into Italian verse by P. Isola.]: Extracts. Italian","Byron, George Gordon Byron - Baron"
558610,Dublin,1836,W. F. Wakeman,"Arnaldo; Gaddo; and other unacknowledged poems; by Lord Byron, and some of his contemporaries; collected [or rather, written] by Odoardo Volpi [pseudonym of Edward N. Shannon]. (The Comedy of Dante Alighieri; translated by Odoardo Volpi. [Containing only the first 10 Cantos of the “Inferno.”]): Doubtful or Supposititious Works","Byron, George Gordon Byron - Baron"
558616,London,1816,J. Johnston,"Lord Byron's Farewell to England; with three other poems, viz. Ode to St. Helena, To my Daughter, on the morning of her birth, and To the Lily of France. [By John Agg.]: Doubtful or Supposititious Works","Byron, George Gordon Byron - Baron"
558617,London,1816,J. Johnston,"[Lord Byron's Farewell to England; with three other poems, viz. Ode to St. Helena, To my Daughter, on the morning of her birth, and To the Lily of France. [By John Agg.]]: Doubtful or Supposititious Works","Byron, George Gordon Byron - Baron"
558618,London,1817,J. Johnston,"Lord Byron's Pilgrimage to the Holy Land. A poem ... To which is added, The Tempest, a fragment [in verse. By John Agg.]: Doubtful or Supposititious Works","Byron, George Gordon Byron - Baron"
558651,London,1871,1. pp. xxiii. 401. James Burns,"The Shade of Byron: a mock heroic poem, containing strange revelations not hitherto disclosed, with copious notes and references ... A preface, with the author's comments on the so-called true “Story,” by Mrs. Stowe. And a repudiation of the charges hurled against the memory of Lord Byron and his beloved sister, Ada Augusta. (Second edition.): Appendix. Biography and Criticism","Byron, George Gordon Byron - Baron"
558661,London,1833,Charles Tilt,"Historical Illustrations of Lord Byron's Works, in a series of etchings, by Reveil, from original paintings, by A. Colin. [With accompanying text.]: Appendix. Miscellaneous","Byron, George Gordon Byron - Baron"
558674,Lahore,1882,Civil & Military Gazette Press,"[Aladdin; or, the Wonderful scamp! An original burlesque extravaganza, in one act. [In verse.]]","Byron, Henry J. (Henry James)"
558675,Bombay,1885,,"[Aladdin; or, the Wonderful scamp! An original burlesque extravaganza, in one act. [In verse.]]","Byron, Henry J. (Henry James)"
558768,Mooltan,1884,“Albion” Press,"[The Rosebud of Stingingnettle Farm; or, the Villanous squire and the virtuous villager, etc. [A play.]]","Byron, Henry J. (Henry James)"
558969,London,1880,C. Wilson,[Sveriges lastageplatser.] The Loading Ports of Sweden. Translated and improved by Kurt Asker,"BYSTRÖM, H."
559185,York,1842,Wiley & Putnam,"Athanasion. Second edition, with notes and corrections. Also, Miscellaneous Poems. By the author of “Christian Ballads,” &c. [The dedication signed: C., i.e. Arthur C. Coxe.]",
559251,Calcutta,1853,"Thacker, Spink & Co.","Rough Pencillings of a Rough Trip to Rangoon in 1846. [Signed: C., i.e. Colesworthey Grant.]",
559252,London,1860,W. Thacker & Co.,"Rural Life in Bengal; illustrative of Anglo-Indian suburban life; more particularly in connection with the planter and peasantry ... Letters from an artist in India to his sisters in England ... By the author of “Anglo-Indian Domestic Life” ... Illustrated with one hundred and sixty six engravings. [Signed: C., i.e. Colesworthey Grant.]",
559566,Paris,1865,,"Rome. [The dedication signed: A. L. M. C., i.e. A. L. de Coulibeuf, Marchioness de Blocqueville.]","C., A. L. M."
559689,London,1683,Printed by John Harefinch,"Sylla's Ghost: a satyr against ambition, and the last horrid plot. [In verse. The dedication signed: C. C.]","C., C.|C., C. C."
559735,London,1870,W. H. Allen & Co.,[Notes on the North-Western Provinces of India. By a District Officer.],"C., C. H. T."
559884,London,1775,E. & C. Dilly,"Notes and Various Readings to Shakespeare, part the first containing, All's Well that ends Well, Anthony and Cleopatra ... With a general glossary. [The “Advertisement to the reader” signed: E. C., i.e. Edward Capell.]","C., E."
560025,Taunton,1819,J. Poole,"The Mélange, containing the Lunarian, a tale, in five cantos. Wonders, in two parts. The Picture Gallery, in nine cantos. And various other pieces, in verse. By F........ C....... [i.e. Frederick Corfield]","C......., F........"
560105,Cheltenham,1830,J. J. Hadley,"Breaking the Line. Statement of facts, in the nature of memoir, leading to and connected with the great battle of the 12th of April, 1782, between the fleet of Great Britain, commanded by Lord Rodney, and that of France, under the Compte de Grasse. By an Old Naval Officer, etc. [The author's letters in the appendix signed: G. C.]","C., G."
560143,"Chambersburg, Pa",1856,M. Kieffer & Co.,"A Tribute to the Principles, Virtues, Habits and Public Usefulness of the Irish and Scotch early settlers of Pennsylvania. By a Descendant. [The preface signed: G. C., i.e. George Chambers.]","C., G."
560180,Marlborough,1887,William Gale,"[The Antiques of Marlborough College. A lecture, etc. [The preface signed: G. E. L. C., i.e. George E. L. Cotton.]]","C., G. E. L."
560246,London,1851,James Ridgway,"Peter Little and the Lucky Sixpence; The Frog's Lecture; and other stories. A verse book for my children and their playmates. [The dedicatory poem signed: H. C., i.e. Henry Campkin.]","C., H."
560335,Köthen,1875,,"Alcilia, Philoparthens Louing Follie ... 1595. Nach dem einzigen Exemplar der ältesten Ausgabe in der Hamburger Stadtbibliothek herausgegeben und eingeleitet von Wilhelm Wagner. Separat-Abdruck aus dem Shakespeare-Jahrbuch, etc","C., I."
560425,London,1874,S. W. Patridge & Co.,"Birkheda Vicarage; the story of a woman's influence. From the Swedish of J. A., author of “The Stark Family” [i.e. J. C. A. von Hofsten], etc","C., J."
560451,Birmingham,1887,Privately printed,"Election Squibs, Ballads & Broadsides, with other impromptu verses, by J- C- [i.e. John Cotton.]","C-, J-."
560476,London,1788,W. Lowndes,"Love in the East; or, Adventures of twelve hours. A comic opera in three acts. Written by the author of the Strangers at Home, etc. [The dedication signed: J. C., i.e. James Cobb.]","C., J."
560572,London,1862,Edward Stanford,"The United States and Canada, as seen by two brothers [J. C., Jun. and A. C.] in 1858 and 1861","C., J. - Jun., and C., (A.)"
560823,Allahabad,1895,Pioneer Press,"A Few Indian Stories. By L. T. C., author of “Through the Eye of a Needle” [i.e. Lionel James]","C., L. T."
560900,London,1896,Theosophical Publishing Society,"[The Idyll of the White Lotus. By M. C., Fellow of the Theosophical Society [i.e. Mabel Collins.]]","C., M. - Fellow of the Theosophical Society"
560997,London,1868,Longmans & Co.,An Illustrated History of Ireland: from the earliest period. By M. F. C. [i.e. Mary F. Cusack.] With historical illustrations by Henry Doyle,"C., M. F."
561005,Citta di Castello,1842,,"Memorie ecclesiastiche e civili di Città di Castello. Raccolte da M. G. M. A. V. di C. di C. [i.e. G. Muzi, Bishop of Città di Castello.] Con dissertazione preliminare sull'antichità ed antiche denominazion di detta città","C., M. G. M. A. V. di C. di."
561105,Dublin,1846,James M'Glashan,The Legend of Naworth. By O. B. C. [i.e. Owen B. Cole.] [In verse.],"C., O. B."
561247,London,1899,Swan Sonnenschein & Co.,The History of South America ... By an American. [The preface signed: R. C.] Translated from the Spanish by Adnah D. Jones. With maps and index by the translator,"C., R."
561439,Edinburgh,1819,,"Extempore to Walter Scott, Esq., on the publication of the new edition of the Bridal of Triermain, etc. [Signed: S. K. C., i.e. R. P. Gillies?]","C., S. K."
561560,Brussels,1840,Hauman & Co.,A Descriptive Tour in Scotland. By T. H. C. [i.e. Chauncy H. Townshend.],"C., T. H."
561581,Paris,1802,,"Tableau général de la Russie moderne, et situation politique de cet empire au commencement du XIXe siècle; par V. C***, continuateur de l'Abrégé de l'histoire générale des voyages [i.e. Victor Delpeuch de Comeiras]","C***, V."
561686,London,1709,Benjamin Bragg,"A Poem humbly inscrib'd to His Grace the Duke of Marlborough, occasion'd upon his repeated victories in Flanders. Wrote in the camp by W. C. an Officer of Major General How's Regiment [i.e. William Churchill]","C., W. - an Officer of Major General How's Regiment"
561696,Adelaide,1860,J. H. Lewis,Who Killed Cockatoo. [A nursery rhyme.] By W. A. C. [i.e. W. A. Cawthorne.],"C., W. A."
561699,London,1888,Hatchard,"St. Paul at Lystra. [In verse. The “Apology” signed: W. A. C. C., i.e. William A. C. Chevalier.]","C., W. A. C."
561729,Coventry,1880,Iliffe & Son,"Romances of the Wheel, a collection of romantic cycling tales. By W. J. C., an old rider [i.e. W. J. Coppen]","C., W. J. - an Old Rider"
561979,London,1872,T. C. Newby,The Alvareda Family. A novelette. Translated ... by Viscount Pollington: Single Works,"CABALLERO, Fernan - pseud. [i.e. Cecilia Francisca Josefa Arrom de Ayala.]"
562483,Manila,1895,,"Estudios sobre Carolinas. La isla de Ponapé. Geografia, etnografia, historia ... Con un prólogo del ... Teniente General D. Valeriano Weyler. [With maps and plans.]","CABEZA PEREIRO, Anacleto."
562560,Edinburgh,1825,John Aitken,"The Cabinet; or, the Selected beauties of literature. [Edited by John Aitken.] Second series",
562582,London,1787,C. Taylor,"The Cabinet of Genius containing frontispieces and characters adapted to the most popular poems, &c. with the poems &c. at large",
562758,London,1888,"Smith, Elder & Co.","Richard Cable, the Lightshipman. By the author of 'Mehalah' [i.e. Sabine Baring Gould], etc","CABLE, Richard."
562883,Philadelphia,1831,Carey & Lea,"[A Memoir of Sebastian Cabot; with a review of the history of maritime discovery. [By Richard Biddle.] Illustrated by documents from the Rolls, now first published.]","CABOT, Sebastian."
563652,Paris,1895,,[Navigations de Alouys de Cademoste.-La Navigation du Capitaine Pierre Sintre ... escrite par Messer Alouys de Cademoste. [Translated by J. Temporal.]]: Voyages. Ramusio's Text,"CÀ DA MOSTO, Alvise da."
563905,London,1895,Remington & Co.,Worthy. A study of friendship. [Edited by John F. Cadell.],"CADELL, Jessie Ellen."
563909,Edinburgh,1898,W. Blackwood & Sons,Sir John Cope and the Rebellion of 1745. [Edited by Thomas Cadell. With maps.],"CADELL, Robert - Sir, K.C.B"
564359,London,1888,Sampson Low & Co.,"Drawing-Room Plays. Selected and adapted from the French by Lady Adelaide Cadogan. Illustrated by E. L. Shute, etc","CADOGAN, Adelaide - Lady"
564746,London,1733,J. Watts,"Cælia: or, the Perjur'd lover. A play, etc. [By Charles Johnson. With a prologue by T. Cibber and an epilogue by H. Fielding.]",
565327,Philadelphia,1871,E. H. Butler & Co.,Cæsar's Commentaries on the Gallic War. With a vocabulary and notes. By Wm. Bingham: De Bello Gallico. Latin,"CAESAR, Caius Julius."
565433,London,1889,G. Bell & Sons,"Caesar's Seventh Campaign in Gaul. B.C. 52. De bello Gallico lib. VII. Edited, with notes, excursus, and tables of idioms, by W. Cookworthy Compton ... With illustrations from sketches by E. T. Compton, and maps: De Bello Gallico. Selected and Single Books. Latin","CAESAR, Caius Julius."
566275,London,1856,John Mitchell,"The Cagot; or, Heart for heart. A play in five acts. [In verse. By Edmund O'Rourke.]",
566867,London,1853,Richard Bentley,"Narrative of a Journey round the Dead Sea and in Bible Lands, in 1850 and 1851 ... Edited, with notes, by Count Edward de Warren. [With a map.]: Voyage autour de la mer Morte et dans les terres bibliques, exécuté de décembre 1850 à avril 1851","CAIGNART DE SAULCY, Louis Félicien Joseph."
566903,London,1815,John Miller,"The Maid and the Magpye; or, which is the Thief? A musical entertainment, in two acts. Freely translated, with alterations, from the French, by S. J. Arnold, etc","CAIGNIEZ, Louis Charles - and BAUDOUIN D'AUBIGNY (Jean Marie Théodore)"
567214,Paris,1830,,"Journal d'un voyage à Temboctou et à Jenné, dans l'Afrique centrale ... pendant les années 1824, 1825, 1826, 1827, 1828 ... Avec une carte itinéraire, et des remarques géographiques, par M. Jomard. [With a portrait.]","CAILLIÉ, René - Traveller"
568334,Codogno,1897,,Codogno e il suo territorio nella cronaca e nella storia,"CAIRO, Gio - and GIARELLI (Francesco)"
568631,London,1832,Effingham Wilson,"Calabria, during a Military Residence of Three Years: in a series of letters by a General Officer of the French Army. From the original MS. [A translation of “Séjour d'un officier français en Calabre” by - Duret de Tavel.]",
570346,Wick,1887,William Rae,"[Sketch of the Civil and Traditional History of Caithness, from the Tenth Century.]","CALDER, James Tait."
571275,London,1896,Iliffe & Son,"The Way about Herefordshire ... Written by C. Caldicott and illustrated by C. Caldicott and A. E. Caldicott. With a comprehensive county gazetteer, edited by A. Baines. (2nd edition.)","CALDICOTT, Charles."
571802,London,1810,W. Dwyer,The Caledonian Comet. [By John Taylor. A satirical poem on Sir Walter Scott.],
571829,Edinburgh,1779,,The Caledonians: a poem. [By Robert Colvill.],
572064,London,1883,J. & R. Maxwell,"The Golden Calf. A novel, by the author of “Lady Audley's Secret” [i.e. Mary E. Braddon, afterwards Maxwell]",
572245,London,1874,B. M. Pickering,"Calcoen. A Dutch narrative of the second voyage of Vasco da Gama to Calicut, printed at Antwerp circa 1504. [A facsimile.] With introduction and translation by J. P. Berjeau. Dutch & Eng",
574721,Boston,1843,T. H. Webb & Co.,"[An Historical Discourse on the Civil and Religious Affairs of the Colony of Rhode-Island and Providence Plantations in New-England in America, from the first settlement 1638 to the end of first century.]","CALLENDER, John - M.A., of Newport, Rhode Island"
575020,Warszawa,1854,,"F. Kallimacha Geminiańczyka O królu Władysławie, czyli o klęsce warneńskiéj. Przetłómaczył, przypisami objaśnił i bijografiją Kallimacha dodał Michał Glisczyński","CALLIMACHUS, Philippus - called Experiens [Filippo Buonaccorsi]"
575255,London,1891,"Ward, Lock & Co.","[Home-Theatricals made Easy, or, Busy, happy, and merry. [With illustrations.]]","CALLOW, Frances Elizabeth - and CALLOW (Alice Mary)"
575680,Toronto,1897,William Briggs,"History of the County of Annapolis, including old Port Royal and Acadia, with memoirs of its representatives in the Provincial Parliament ... Edited and completed by A. W. Savary ... With portraits and illustrations. (Supplement to the History of the County of Annapolis. Correcting and supplying omissions in the original volume. By A. W. Savary, etc.)","CALNEK, William Arthur."
576035,Dublin,1784,James Hunter,"Orpheus and Eurydice, an English Musical Drama, etc. (Translated into poetical English [by G. F. Tenducci].)","CALSABIGI, Ranieri de'."
576363,London,1885,G. Bell & Sons,The Literary Remains of Charles Stuart Calverley. With a memoir by Walter J. Sendall. With portrait and illustrations,"CALVERLEY, Charles Stuart."
576406,London,1897,William Heinemann,"My Fourth Tour in Western Australia ... Illustrated by Walker Hodgson, etc. [With a portrait.]","Calvert, Albert Frederick"
577709,Paris,1897,,[Notas de viage-Colombia y Estados Unidos de America.],"CAMACHO ROLDAN, Salvador."
578433,London,1849,,"Cambrian Tales. [By Jane Williams. Portions, containing the Cambrian Tales, taken from vol. 15-17 of Ainsworth's Magazine, and bound together.]",
578435,London,1821,Edward & Knibb,"[The Cambrian Tourist; or, Post-Chaise companion through Wales ... Fifth [or rather, fourth] edition. [By - Cliff, of Worcester?]]",
579863,Cambridge,1831,Benjamin Bridges,"The Poll on the Election of a Representative in Parliament, for the County of Cambridge ... October, 1831; to which is added, a list of the members for the county, from 1660, till the present time. By Charles Henry Cooper: Official Documents",
579900,Cambridge,1894,Cambridge Express Newspaper Co.,An Artist's Rambles in Cambridgeshire. A series of sketches [signed: John S. Clarke] with descriptive letterpress reprinted from “The Cambridge Express.”: Appendix,
581515,London,1896,F. V. White & Co.,"Two Cousins and a Castle, etc","CAMERON, Caroline Emily.|CAMERON, Donald - of Lochiel, 22nd Chief of the Clan Cameron"
582254,Paris,1878,,"A travers l'Afrique. Voyage de Zanzibar à Benguela, traduit ... par Mme H. Loreau, etc. [With plates and a map.]","CAMERON, Verney Lovett."
582379,Wien,1881,,Urkundliche Beiträge zur Geschichte Wien's im XVI. Jahrhundert ... Mit einem Stadtplane. [Edited by Carl Weiss.],"CÁMESINA, Albert von."
582470,London,1877,R. Bentley & Son,"Camille's Tormentor. By the author of “We are Worldlings” [i.e. Bertha de Jongh], etc",
583436,"Wisbech; Simpkin, Marshall & Co",1880,Leach & Son,[The Camp of Refuge. [By Charles MacFarlane.]],
583437,"Wisbech; Simpkin, Marshall & Co",1887,Leach & Son,[The Camp of Refuge. [By Charles MacFarlane.]],
583953,Philadelphia,1834,M'Carty & Davis,"Description of the Province of New Sweden, now called ... Pennsylvania, etc","CAMPANIUS HOLM, Thomas."
584143,Edinburgh,1798,Andrew Foulis,"An Introduction to the History of Poetry in Scotland from the beginning of the thirteenth century to the present time; with a conversation on Scotish song ... To which are subjoined Sangs of the Lowlands of Scotland ... With characteristic designs, composed and engraved by ... David Allan","CAMPBELL, Alexander - Musician and Poet"
584350,Edinburgh,1816,A. Constable & Co.,"A Voyage round the World, from 1806 to 1812 ... Including a narrative of the author's shipwreck on the island of Sannack with an account of the ... Sandwich Islands and a vocabulary of their language. [Edited by James Smith. With a map.]","CAMPBELL, Archibald - Seaman"
584472,London,1897,A. D. Innes & Co.,Deilie Jock,"CAMPBELL, C. M. - Novelist|CAMPBELL, Caroline."
584592,London,1894,R. Bentley & Son,"Letters from Camp to his Relatives during the Siege of Sebastopol. By C. F. Campbell. With a preface by Field-Marshal Viscount Wolseley, etc. [Edited by R. B. Mansfield.]","CAMPBELL, Colin Frederick - Baron Campbell"
584737,Sneek,1895,,"De Puriteinen in Nederland, Engeland en Amerika ... Vertaald door J. W. G. van Maanen","Campbell, Douglas"
