Identifier,Place of Publication,Date of Publication,Publisher,Title,Author
1810122,St. Petersburg,1882,,"Mittheilungen der internationalen Polar-Commission, redigirt von H. Wild, etc",
1812198,York,1861,J. Sampson,"The Antidote. A Letter of Enquiry addressed to R. J. Parker, Esq., and the Ratepayers of ... Selby. A sequel to Mr. Parker's Letter to ... Lord Londesborough. [Signed: Investigator.]",
1812854,London,1864,,Four years in the Ionian Islands. Their political and social condition. With a history of the British Protectorate. Edited by Viscount Kirkwall: Appendix,
1812885,Berlin,1895,,Durch Süd-Amerika. Reise- und kulturhistorische Bilder ... Vom Autor bis auf die neueste Zeit vervollständigte Ausgabe ... Übersetzt von M. v. Pezold,"Ionin, Aleksandr."
1814020,Paris,1859,,"Histoire politique de la Révolution de Hongrie, 1847-49, etc","IRANYI, Daniel - and CHASSIN (Charles Louis)"
1814208,London,1823,T. White and Co.,"Travels in Egypt and Nubia, Syria and Asia Minor: during the years 1817 & 1818","IRBY, Charles Leonard - Hon., and MANGLES (James)"
1814210,London,1868,John Murray,"Travels in Egypt and Nubia, Syria, and the Holy Land ... New edition","IRBY, Charles Leonard - Hon., and MANGLES (James)"
1818826,London,1796,,"Mr. I's vindication of his conduct respecting the publication of the supposed Shakspeare MSS. [viz. those fabricated by S. W. H. Ireland,] being a preface or introduction to a reply to the critical labors of Mr. Malone, in his Enquiry into the authenticity of certain papers, etc","IRELAND, Samuel."
1818869,Oxford,1663,H. Hall for R. Davis,"Verses spoken at the appearance of the King and Queene, Duke and Dutchesse of York, in Christ-Church Hall, Oxford, Sept: 29. 1663. (Verses spoken to the King, Queen, and Dutchesse of Yorke in St John's Library in Oxford. [By Thomas Laurence?])","IRELAND, Thomas - Student of Christ Church"
1820574,London,1855,Thomas Cantley Newby,"Catherine Irving. A novel. By the author of “Ada Gresham” [i.e. Mary Anne Lupton, afterwards Needell]","IRVING, Catherine."
1820761,Glasgow,1864,,The Upper Ward of Lanarkshire described and delincated. The archæological and historical section by G. V. Irving. The statistical and topographical section by A. Murray,"Irving, George Vere."
1820917,London,1835,,"The Conquest of Florida, under Hernando de Soto","IRVING, Theodore."
1820978,London,1896,Macmillan & Co.,The Alhambra ... With an introduction by E. R. Pennell. Illustrated with drawings of the places mentioned by J. Pennell: Single Works,"IRVING, Washington.|IRVING, Washington."
1821779,London,1827,,"Isaac Comnenus; a play [in five acts and in verse, by Sir H. Taylor]",
1822979,London,1875,,"Iseulte. By the author of “Vera,” etc. [Miss C. L. H. Dempster.]",
1823010,Cincinnati,1890,Lyman & Cushing,"Prisoners of War and Military Prisons. Personal narratives ... With a general account of Prison Life and Prisons in the South during the War of the Rebellion, ... by A. B. Isham ... H. M. Davidson ... and H. B. Furness. [Illustrated.]","ISHAM, Asa Brainerd."
1823263,London,1884,W. H. Allen & Co.,"Ishtar and Izdubar, the epic of Babylon; or, the Babylonian Goddess of Love and the Hero and Warrior King; constructed from the great Accadian Epic ... found in cuneiform inscriptions on tablets ... now deposited in the British Museum ... Restored in modern verse, by L. Le C. Hamilton, etc",
1823645,London,1779,J. Murray,"The Injured Islanders; or, the Influence of art upon the happiness of nature. [A poem. By Gerald Fitzgerald",
1823658,Edinburgh,1890,Privately printed,The Stent Book and Acts of the Balliary of Islay 1718-1843. [Edited by Lucy Ramsay.],
1823663,London,1633,,"The Ile of Gulls [a comedy in five acts and in prose. By J. Day]. As it hath been often acted in the Black Fryers, by the Children of the Revels",
1824416,London,1862,Mitchell,"Israel's Return from Babylon, an oratorio in four parts ... Composed by J. R. Schachner, etc",
1824718,London,1849,,"Forty Days in the Desert on the track of the Israelites; or, a Journey from Cairo by Wady Feiran to Mount Sinai and Petra. By the author of “Walks about Jerusalem” [i.e. William Henry Bartlett.] Third edition. [With illustrations and plates.]",
1824719,London,1862,H. G. Bohn,"[Forty Days in the Desert on the track of the Israelites; or, a Journey from Cairo by Wady Feiran to Mount Sinai and Petra. By the author of “Walks about Jerusalem” [i.e. William Henry Bartlett.] Third edition. [With illustrations and plates.]]",
1824901,Clermont Ferrand,1848,,"Annales de la Ville d'Issoire, manuscrit inédit sur l'histoire des guerres religieuses en Auvergne au 16e et 17e siècles, [variously attributed to Jean Charrier and Julien Blauf,] accompagné de notes; publié par J.-B. Bouillet. [With a map.]",
1824950,Debreczen,1871,,Magyarország Története. 1490-1606 ... Forditotta Vidovich Gy,"ISTHVANFIUS, Nicolaus."
1825232,London,1876,,It might have been. A novel. By the author of “Tit for Tat” [Jane Grace Smith],
1825607,London,1825,,"Italian Scenes: a series of interesting delineations of remarkable views, and of ... celebrated remains of antiquity, etc. ([Chiefly] sketched by the Hon. K. Craven.) [With descriptive letterpress.]",
1831817,London,1859,Robert Hardwicke,The Holy War by John Bunyan versified by E. J. With an introductory essay by the Rev. Octavius Freire Owen,"J., E."
1831875,Leipzig,1859,,Treue Geschichte der Drangsale die das deutsche Dorf J. ... bei Mainz im ersten Revolutionskriege durch die Franzosen erlitten ... berichtet von F. L. J,"J., F. L."
1831919,Manchester,1882,J. E. Cornish,A Voyage in the S.S. Oceanic. By H. J[ardine],"J., H."
1832141,London,1890,D. Nutt,"The Tragedy of Captain Harrison; or, the Brownlow Street Mystery. Put together ... from the conflicting reports of the “Tryal of Hen. Harrison, gent.,” and the “Last words” of the convict, Lond. 1692. By R. C. J","J., R. C."
1832148,London,1899,T. F. Unwin,At the Sign of the Palm Tree. A record of some idle hours in sunset land by Madge Mortimer. Edited [or rather written] by R. L. N. J[ohnston],"J., R. L. N."
1832587,Lwów,1847,,"Okolice Galicyi M. B. Stęczyńskiego. [88 lithographic views from drawings by M. B. Stęczyński, with descriptive letter-press to nos. 1-80 by K. J.]","JABŁOŃSKI, Kajetan."
1832753,London,1897,Lawrence & Bullen,On the Trail of Don Quixote: being a record of rambles in the ancient province of La Mancha ... Illustrated by D. Vierge,"JACCACI, August F."
1833811,London,1862,,"Robert O'Hara Burke, and the Australian Exploring Expedition of 1860","JACKSON, Andrew - Ensign"
1834146,London,1898,Phillimore & Co.,"Annals of Ealing, from the twelfth century to the present time. Compiled from manorial and parochial documents ... With introductory preface by W. E. Oliver","JACKSON, Edith."
1834603,London,1893,R. Tuck & Sons,"Bonnie Bairns. Illustrated by H. Jackson. Edited by Edric Vredenburg. Verses by E. M. Chettle, etc","JACKSON, Helen - Illustrator"
1834905,Berlin,1804,,"Landreise aus Ostindien nach Europa, unternommen im Jahre 1797 auf einem ... wenig bekannten Wege durch die ... Türkey, Siebenbürgen, Ungarn und Teutschland. Auszugsweise aus dem Englischen übersetzt. L. Degrandprés Reise nach der westlichen Küste von Afrika, oder dem Königreiche Loango, in den Jahren 1786 und 1787. Aus dem Französischen übersetzt ... von M. C. Sprengel","JACKSON, John - F.S.A"
1837830,London,1692,,The Jacobite Conventicle. A poem [By Richard Ames],
1838738,Leipzig,1884,,"Capitain Jacobsen's Reise an der Nordwestküste Amerikas 1881-1883 zum Zwecke ethnologischer Sammlungen und Erkundigungen, nebst Beschreibung persönlicher Erlebnisse ... bearbeitet von A. Woldt, etc","JACOBSEN, J. Adrian."
1838739,Kristiania,1887,,"Kaptein Jacobsens Reiser til Nordamerikas Nordvestkyst 1881-83 ... udarbeidet af A. Woldt. Oversat fra Tysk ved J. Utheim, etc. [Illustrated.]","JACOBSEN, J. Adrian."
1838886,Kjøbenhavn,1897,,Den Nordiske Kriigs Krønicke utgifwen af Martin Weibull,"JACOBSEN, Sten."
1840486,Paris,1845,,"Rueil, le château de Richelieu, la Malmaison, avec pièces justificatives","JACQUIN, Jules - and DUESBERG (Joseph)"
1841674,Madras,1863,,"[Qanoon-e-Islan, or the Customs of the Moosulmans of India; comprising a full and exact account of their various rites and ceremonies ... By Jaffur Shurreef. Composed under the direction of, and translated by, G. A. Herklots.]",
1842585,Leipzig,1847,,"Praktische Anleitung zum gründlichen Studium der Erdkunde nach ihrer mathematischen, physikalischen und politischen Bedeutung","JAHN, Gustav Adolph - and VOGEL (Emil Ferdinand)"
1843254,Budán,1870,,Kolozsvár története ... oklevéltárral. (Kolozsvár története világositó rajzai ... kőre metszette Haske F.),"JAKAB, Elek."
1844591,London,1860,,Valentine Duval; an autobiography of the last century [translated from the French by Miss B. Stebbing afterwards Mrs. Batty]. Edited by the author of “Mary Powell” [Miss A. Manning],"JAMERAY DUVAL, Valentin."
1845250,Edinburgh,1783,J. and E. Balfour,"Poetical Remains of James the First, King of Scotland. (A dissertation on the life and writings of James I.-Dissertation on the Scottish music [by the Editor, W. Tytler].)",
1845815,London,1897,J. C. James,"Some Impressions of East and South-East Africa. [With a portrait, and with an obituary notice of the author, signed: S. W. B.]","JAMES, Charles D."
1846047,London,1896,H. Frowde,Letters archaeological and historical relating to the Isle of Wight. By ... E. B. James ... Collected and arranged by his widow (R. B. James). [With a biographical sketch.],"JAMES, Edward Boucher."
1846073,Philadelphia,1823,,"Account of an expedition from Pittsburgh to the Rocky Mountains, performed in the years 1819 and 20 ... under the command of Major Long, T. Say and other gentlemen of the party","JAMES, Edwin - Botanist"
1846217,London,1888,G. Philip & Son,"The Unknown Horn of Africa. An exploration from Berbera to the Leopard river ... With additions by G. J. Thrupp ... The narrative illustrations by Rose Hake, and the drawings of the fauna by K. Keuleman, etc","JAMES, Frank Linsly."
1846218,London,1890,G. Philip & Son,"The Unknown Horn of Africa ... Second edition, containing the narrative portion and notes only. With an obituary notice by J. A. & W. D. James","JAMES, Frank Linsly."
1846361,London,1849,,"An investigation of the circumstances attending the murder of John, Earl of Gowrie and Alexander Ruthven, by order of King James the Sixth of Scotland; with an Examination of the forged Restalrig Letters brought forward to exculpate the King","James, G. P. R. (George Payne Rainsford)"
1846455,London,1852,,"Adrian, or, the Clouds of the Mind: a romance","James, G. P. R. (George Payne Rainsford)"
1847327,Firenze,1875,,All' Arciconsolo e al soci della R. Accademia della Crusca. Versi ... Tradⁿe di A. Severini,"JAMES, John Kingston - Sir, Bart"
1848080,London,1897,Kegan Paul & Co.,The Wolseley Series. Edited by Capt. W. H. James. Vol. 1-7,"JAMES, Walter Haweis."
1848119,London,1819,,"Warden refuted; being a defence of the British navy against the misrepresentations of a work ... entitled, “A statistical ... account of the United States of North America,” by D. B. Warden, ... in a letter to the author of that work","JAMES, William - Historical Writer"
1848459,London,1890,R. H. Porter,"Story of the Rear Column of the Emin Pasha Relief Expedition ... Edited by Mrs. J. S. Jameson. [With a preface by Andrew Jameson.] With ... map and illustrations, etc. (Natural-History appendix. The Ornithological work of J. S. Jameson. By R. B. Sharpe. List of Coleoptera collected by Mr. Jameson on the Aruwimi. By H. W. Bates. Lepidptera Rhopalocera by F. D. Godman and O. Salvin. Lepidoptera Heterocera by H. Druce.)","JAMESON, James S."
1850529,St. Helena,1840,,[The Exhumation of the Remains of Napoleon Bonaparte.] MS. notes [by J. Lockwood],
1850547,London,1864,,"Janita's Cross. By the Author of “St. Olave's” [Eliza Tabor, afterwards Stephenson.]",
1850759,Paris,1853,,"Slaves du sud, ou le peuple serbe avec les Croates et les Bulgares, aperçu de leur vie historique, politique et sociale","JANKOVIĆ, Milovan - and GRUJIĆ (Jevrem)"
1851057,Freiburg im Breisgau,1893,,Die Vereinigten Staaten Nordamerikas in der Gegenwart ... [Translated and edited] von ... W. Kämpfe. (Brief F. Le Plays an C. Jannet.),"JANNET, Claudio."
1851437,Wiesbaden,1897,,"Schleswig-Holsteins Befreiung. Herausgegeben aus dem Nachlass des Professors Karl Jansen und ergänzt von Karl Samwer, etc","JANSEN, Carl - of Kiel"
1852138,Middelburg,1856,,"Bijdragen tot de Oudheidkunde en Geschiedenis, inzonderheid van Zeeuwsch-Vlaanderen","JANSSEN, Hendrik Quirinus - and DALE (J. H. van)"
1852172,Freiburg im Breisgau,1878,,Geschichte des deutschen Volkes seit dem Ausgang des Mittelalters. Bd. 1-8,"JANSSEN, Johann - Phil. Doct"
1852176,Paris,1887,,L'Allemagne et la réforme ... Traduit de l'allemand sur la quatorzième édition [of Janssen's “Geschichte des deutschen Volks seit dem Ausgang des Mittelalters”]: [Geschichte des Deutschen Volkes seit dem Ausgang des Mittelalters],"JANSSEN, Johann - Phil. Doct"
1852821,Havre,1861,,"Les Chateaux de l'arrondissement du Havre, description historique, archéologique et pittoresque ... faisant suite aux Promenades dans Quatre Chateaux Historiques aux environs du Havre ... Poésie par J. Bigot","JANVRAIN, L. A."
1853692,London,1841,,"Manners and customs of the Japanese, in the nineteenth century; from recent Dutch visitors of Japan, and the German of Dr. P. F. von Siebold. [Edited by Mrs. W. Busk.]",
1854252,London,1879,Hurst and Blackett,"Young Mrs. Jardine. [A novel.] By the author of John Halifax, Gentleman [D. M. Mulock afterwards Craik.]",
1854253,London,1880,Hurst & Blackett,"[Young Mrs. Jardine. [A novel.] By the author of John Halifax, Gentleman [D. M. Mulock afterwards Craik.]]",
1854273,London,1841,[Privately printed],"Remarks upon the Letters of Thomas Winter and the Lord Mounteagle, lately discovered by J. Bruce ... Also upon the evidence of Lord Mounteagle's implication in the Gunpowder Treason, etc. (From the Archaeologia, etc.)","JARDINE, David - Police Magistrate"
1854770,London,1871,,"Diary of an Embassy from King George of Bohemia to King Louis XI. of France, in the year ... 1464. From a contemporary manuscript, literally translated from the original Slavonic [of-Jaroslaw] by A. H. Wratislaw","JAROSLAW - Attaché to an Embassy from Bohemia to France, 1464"
1855207,Honolulu,1872,,"[History of the Hawaiian or Sandwich Islands ..., from the earliest traditionary period to the present time.]","Jarves, James Jackson"
1855791,London,1865,,Sir Jasper's Tenant. By the Author of “Lady Audley's Secret” ... [M. E. Braddon]. Fifth edition,
1856144,Pest,1853,,"A Magyar nemzet napjai a legrégibb idötöl az Arany Bulláig. ... Kiadta ... Toldy F. (Jászay Pál emlékezete, olvasta ... Toldy F.)","JÁSZAY, Pál."
1856769,London,1899,T. F. Unwin,Alpine Memories by Émile Javelle. With a biographical and literary notice by Eugène Rambert. Translated and with an introduction by W. R. Chesson,"JAVELLE, Jean Marie Ferdinand Émile."
1857537,we Lwowie,1849,,Krótho zebrana metoda nauki chronologii i dziejów podług ... A. J. Przełożył z francuzkiego i niektóre objaśnienia dodał S. Zanański,"JAŹWIŃSKI, Antoni."
1857620,London,1673,,The Fatal Jealousie. A Tragedy [in five acts and in verse. By N. Payne],
1858108,York,1882,A. T. B. De Witt,"History of the ... voyage and ... shipwreck of the U.S. steamer “Jeannette,” in the Polar seas, together with a full ... account of the death of Lieutenant De Long, ... and the rescue of Danenhower, Melville, and their heroic companions ... Compiled from authentic records [by H. L. Williams]",
1858319,London,1860,,"The Tommiebeg Shootings; or, a Moor in Scotland. ... With illustrations, by P. Skelton","JEANS, Thomas - Novelist"
1858666,Davos,1899,,Der Anteil Graubündens am Schwabenkrieg. Festschrift zur Calvenfeier. (Geschichtliche Darstellung von C. Jecklin. Berichte und Urkunden zusammengestellt von F. Jecklin.),"JECKLIN, Constanz."
1858667,Chur,1886,,Benedict Fontana und die historische Kritik,"JECKLIN, Constanz."
1858978,London,1896,Simpkin & Marshall,The Early Fiction of Richard Jefferies. Edited by G. Toplis. With a rare portrait: Smaller Collections,"Jefferies, Richard"
1859041,London,1896,Simpkin & Marshall,Jefferies' Land: a history of Swindon and its environs ... Edited with notes by G. Toplis. With map and illustrations: Single Works,"Jefferies, Richard"
1859240,London,1889,Aldine Publishing Co.,"The Shadows of a Great City. A story of our day. [By H. L. Williams.] Founded, under special permission, on the celebrated drama by J. J. ... and L. R. S","JEFFERSON, J. - and SHEWELL (L. R.)"
1859304,London,1895,Sampson Low & Co.,A wheel to Moscow and back. The record of a record cycle ride ... With a preface by ... A. R. Savile,"JEFFERSON, Robert L."
1859383,"Brooklyn, N.Y",1894,Historical Printing Club,"Notes on the State of Virginia ... A reprint of the original edition of 1784; with the additions, corrections, and illustrations added by the author in all subsequent editions; together with notes from other sources, and an introduction. Edited by P. L. Ford: Single Works","Jefferson, Thomas"
1860267,w Lwowie,1819,,"O Polozcze jey dziejach i konstytucyi dzieło ... przez K. Słotwińskiego zpolszczone, ... i przypisami pomnożone","JEKEL, Franz Joseph."
1861480,London,1887,Longmans & Co.,"Papers literary, scientific, &c. ... Edited by Sidney Colvin ... and J. A. Ewing ... With a memoir by R. L. Stevenson","JENKIN, Henry Charles Fleeming."
1861749,Portmadoc,1899,Llewelyn Jenkins,"Bedd Gelert: its facts, fairies, & folk-lore. (Based upon the articles by Mr. William Jones in Y Brython.) ... With translations of poetry by the Rev. H. E. Lewis and an introduction by Principal J. Rhys","JENKINS, David Erwyd."
1862068,London,1876,,"Ginx's Baby. ... Thirty-sixth edition, illustrated by F. Barnard","JENKINS, John Edward."
1862073,London,1879,,Jobson's Enemies. [A tale.] In eight books. (Illustrated by F. Barnard.),"JENKINS, John Edward."
1862126,Auburn,1850,,"United States exploring expeditions. Voyage of the U.S. exploring squadron, commanded by Captain C. Wilkes ... in 1838-42, together with explorations and discoveries made by Admiral D'Urville, Captain Ross, and other Navigators and Travellers; and an account of the expedition to the Dead Sea, under Lieutenant Lynch ... With numerous illustrations","JENKINS, John S."
1862506,London,1898,Hutchinson & Co.,Fiona M'Iver: a romance of the Western Isles,"JENKINSON, Arthur - and (Emily J.)"
1863215,London,1876,,Jennie of “The Prince's.” A Novel. [By B. H. Buxton.],
1863645,London,1877,,"Field Paths and Green Lanes: being country walks, chiefly in Surrey and Sussex. ... Illustrated with sketches by J. W. Whymper","JENNINGS, Louis John."
1863652,London,1880,John Murray,Rambles among the Hills in the Peak of Derbyshire and the South Downs ... With illustrations [by A. H. H. Murray],"JENNINGS, Louis John."
1864717,Berlin,1890,,"Der Schwarzwald ... Mit Illustrationen von W. Hasemann, etc","JENSEN, Wilhelm Hermann."
1865015,Leipzig,1890,,"Emin Pascha und die Meuterei in Aequatoria ... Aus dem Englischen von H. von Wobeser, etc","Jephson, A. J. Mounteney (Arthur Jermy Mounteney)"
1865061,London,1881,G. Routledge & Sons,"With the Colours; or, the piping times of peace ... With illustrations by R. Simkin","JEPHSON, Richard Mounteney."
1865063,London,1869,,"Our Life in Japan ... With illustrations from photographs by Lord W. Kerr, etc","JEPHSON, Richard Mounteney - and ELMHIRST (Edward Pennell)"
1865300,London,1895,Tower Publishing Co.,Sibyl Falcon. A study in romantic morals ... Illustrated by H. Piffard,"JEPSON, Edgar Alfred."
1865511,Edinburgh,1878,Andrew Elliot,Essays and Lyrics ... Edited by ... Charles Jerdan. [With a portrait and biographical sketch of the author.],"JERDAN, Samuel Smiles."
1865853,London,1882,W. Ridgway,"The Siege of Berwick, a tragedy [in four acts and in verse] ... Edited by H. E. H. Jerningham","JERNINGHAM, Edward."
1866335,Paris,1894,,"Trois Hommes dans un Bateau ... Traduit de l'anglais par Henri Bouissou. Illustré de 20 gravures, etc: Single Works","Jerome, Jerome K. (Jerome Klapka)"
1866350,London,1895,Chatto & Windus,The Prude's Progress. A comedy in three acts. [By J. K. Jerome and Eden Phillpotts.]: Works written in collaboration,"Jerome, Jerome K. (Jerome Klapka)"
1866711,London,1867,,[The Story of a Feather.]: Single Works,"Jerrold, Douglas William"
1866835,London,1884,W. H. Allen & Co.,At Home in Paris. [Edited by E. D. and S. Jerrold.]: Single Works,"JERROLD, William Blanchard."
1866969,St. Helier],1858,P. Falle,"Chroniques de Jersey, dont l'auteur est inconnu; revues et corrigées sur les manuscrits les plus complets, avec une préface, un essai, un errata, et un appendice, par A. Mourant ... Suivies d'un abrégé historique des îles de Jersey, Guernesey, Auregny, et Serk, par G. S. Syvret: Appendix",
1866989,Jersey,1887,W. Guiton,"The Jubilee Guide to Jersey, in rhyme, by a Modern Troubadour [Patrick O'Carroll]: Appendix",
1867533,Edinburgh,1882,D. Douglas,"[The history and traditions of the land of the Lindsays in Angus and Mearns, with notices of Alyth and Meigle; ... to which is added an appendix, containing ... interesting documents.]","JERVISE, Andrew."
1867536,Edinburgh,1885,D. Douglas,Memorials of Angus and the Mearns. (Second edition.) Re-written ... by ... J. Gammack. [Illustrated with etchings.] L.P,"JERVISE, Andrew."
1868021,Copenhague,1898,,"Copenhague. La capitale du Danemark, etc. [Edited by F. van Jessen. Translated by M. P. Osterby.]","JESSEN, Franz von."
1869858,London,1891,Chapman & Hall,The Christ that is to be. A latter-day romance. [By Joseph C. Rickett.],
1870447,London,1713,"Printed, and are to be sold by J. Morphew",An Hymn to the Redeemer. [By William Goldwin.],
1871049,London,1779,J. Murray,"The Prince of Peace, and other poems. [By E. Cartwright.]",
1873834,London,1877,,A Jewel of a Girl. By the author of “Queenie” [May Crommelin],
1874355,London,1874,,The Stately Homes of England ... Illustrated with ... engravings on wood,"JEWITT, Llewellynn Frederick William - and HALL (Samuel Carter)"
1876770,London,1689,,The Female Prelate: being the history and the life and death of Pope Joan. A tragedy [in five acts and in verse]. Written by a Person of Quality [i.e. Elkanah Settle],
1876811,London,1879,,"Joan the Maid: deliverer of England and France. A story of the fifteenth century. By the author of “Chronicles of the Schönberg-Cotta Family,” etc. [Mrs. E. Charles.]: Appendix",
1876953,Paris,1861,,"Itinéraire descriptif, historique, et archéologique de l'Orient ... accompagné de 11 cartes et de 19 plans","JOANNE, Adolphe Laurent - and ISAMBERT (Emile)"
1877246,Eisenach,1888,,Johann Rothe's Chronik von Thüringen. Bearbeitet und herausgegeben von ... E. Fritsche,
1878522,Montréal,1889,,Histoire de Longueuil et de la famille de Longueuil. Avec gravures et plans,"JODOIN, Alex - and VINCENT (J. L.)"
1878547,Londra,1821,A spese dell’autore,L'Eroina Persiana. Opera dalla tragedia di R. P. Jodrell ... tirata dall'autore. [Translated into Italian by G. Caravita.],"JODRELL, Richard Paul."
1880110,London,1899,"Ward, Lock & Co.",With Nansen in the North: a record of the Fram expedition in 1893-96. ... Translated from the Norwegian by H. L. Brækstad. [With illustrations.],"JOHANSEN, Frederik Hjalmar."
1882514,London,1878,,John-a-Dreams. A tale. [By J. R. Sturgis.],
1886877,London,1792,"Printed for T. Longman, etc.","The Works of Samuel Johnson, LL.D. A new edition ... with an essay on his life and genius by Arthur Murphy: Works","JOHNSON, Samuel - LL.D"
1886881,London,1806,"J. Johnson, etc.","The Works of Samuel Johnson, LL.D. A new edition ... With an essay on his life and genius by Arthur Murphy. [With a portrait. Edited by A. Chalmers.]: Works","JOHNSON, Samuel - LL.D"
1887109,Glasgow,1817,R. Chapman,"A Journey to the Western Islands of Scotland ... With remarks by the Rev. Donald McNicol, etc. [With a portrait.]: Single Works. A Journey to the Western Islands of Scotland","Johnson, Samuel"
1887174,London,1897,,Johnson's Lives of Prior and Congreve. With introduction and notes by F. Rvland: Single Works. The Lives of the English Poets,"JOHNSON, Samuel - LL.D"
1887181,London,1893,,Johnson's Life of Addison. With introduction and notes by F. Ryland: Single Works. The Lives of the English Poets,"JOHNSON, Samuel - LL.D"
1887185,London,1895,,Johnson's Life of Dryden. With introduction and notes by F. Ryland: Single Works. The Lives of the English Poets,"JOHNSON, Samuel - LL.D"
1887195,London,1894,,Johnson's Life of Milton. With introduction and notes by F. Ryland: Single Works. The Lives of the English Poets,"JOHNSON, Samuel - LL.D"
1887208,London,1894,,Johnson's Life of Swift. With introduction and notes by F. Ryland: Single Works. The Lives of the English Poets,"JOHNSON, Samuel - LL.D"
1887400,Oxford,1888,Clarendon Press,"Wit and Wisdom of Samuel Johnson, selected and arranged by G. B. Hill: Selections","JOHNSON, Samuel - LL.D|JOHNSON, Samuel - LL.D"
1888248,London,1877,,"[Dictionary of Geography, etc. New edition, revised to August 1864.]","JOHNSTON, Alexander Keith - the Elder"
1888270,London,1889,E. Stanford,A short Geography of Africa ... Edited by E. G. Ravenstein. Reprinted from the fifth ... edition ... of Keith Johnston's School ... Geography,"JOHNSTON, Alexander Keith - the Younger"
1889397,Edinburgh,1872,,The Historical Geography of the Clans of Scotland. (Map of the Clans of Scotland) [and other diagrams],"JOHNSTON, Thomas Brumby - and ROBERTSON (James Alexander)"
