Identifier,Place of Publication,Date of Publication,Publisher,Title,Author
1026337,St. Pétersbourg,1867,,En Orient. Impressions et réminiscences. [By Count N. Adlerberg.] L.P,
1027606,London,1837,,"An Easter Monday-Ode. By the author of lines on the opening of London Bridge, etc. [J. Payne]",
1028138,Albany,1858,J. Munsell,A narrative of the causes which led to Philip's Indian war of 1675 and 1676 ... With other documents concerning this event ... Prepared from the originals with an introduction and notes. By F. B. Hough. F.P,"EASTON, John - of Rhode Island"
1028307,London,1877,,Calumny. A novel ... With illustrations by Marcus Stone,"EASTWOOD, Frederick."
1028565,London,1892,F. Warne and Co.,Tales of a Garrison Town,"EATON, Arthur Wentworth Hamilton - and BETTS (Craven Langstroth)"
1030114,Wiesbaden,1890,,Kritische Bemerkungen über Heinrich von Sybel's Begründung des Deutschen Reiches durch Wilhelm I,"EBERSTEIN, Alfred von - Baron"
1030122,Berlin,1891,,Kriegsberichte des Königl. Dänischen General-Feldmarschalls E. A. von Eberstein aus dem zweiten schwedisch-dänischen Kriege. Herausgegeben ... von L. F. Freiherrn von Eberstein ... Zweite Ausgabe,"EBERSTEIN, Ernst Albrecht von."
1030130,Nordhausen,1868,,“Dem Landfrieden ist nicht zu trauen.” Fehde Mangold's von Eberstein zum Brandenstein gegen die Reichsstadt Nürnberg 1516-1522. Charakterbild der rechtlichen und wirthschaftlichen Zustände im Deutschen Reiche unmittelbar vor dem grossen Bauernkriege. Herausgegeben nach urkundlichen Aufzeichnungen und Briefen im k. Archive zu Nürnberg von Louis Ferdinand Freiherrn von Eberstein,"EBERSTEIN, Mangold von."
1030935,Keighley,1839,Printed by R. Aked,Two Essays on the Obligations of Ministers and Churches to the Baptized. By W. Eccles and W. Tiler,"ECCLES, William - of Leeds"
1030962,London,1848,,"Ecclesia Dei: a Vision of the Church, [by William John Blew.] with a preface, notes and illustrations",
1031638,Leipzig,1865,,"York und Paulucci. Aktenstücke und Beiträge zur Geschichte der Convention von Tauroggen. (18/30 December, 1812.) Aus dem Nachlass G. Merkel's herausgegeben. [With a sketch of Merkel's life.]","ECKARDT, Julius Wilhelm Albert von."
1032054,A. Green,1887,Bolton,"Human sympathy. A collection of rough blocks of verse, by “one of those who loves his fellow men”. [Signed: E. R. E., i.e. E. R. Eckersley.]","ECKERSLEY, Edmund Ryley."
1032177,Köln,1853,,"Die Benedictiner-Abtei M. Gladbach. Ein Beitrag zur Geschichte des Herzogthums Jülich, von G. E. und E. J. K. N. Nebst ungedruckten Urkunden, mehreren Siegeln und einer Abbildung der Münsterkirche","ECKERTZ, Gottfried - and NOEVER (E. J. Konr.)"
1034414,London,1872,,Letters from India. By the Hon. E. E. Edited by her Niece [the Hon. Eleanor Eden],"EDEN, Emily - Hon"
1034689,Jamaica,1891,De Cordova and Co.,The Island of Grand Cayman at the Jamaica Exhibition. Historical sketch and descriptive catalogue,"EDEN, William T. - and MAC LAUGHLIN (E. Noel)"
1034803,London,1873,,True to the End. A story of Scottish life,"EDERSHEIM, Alfred."
1034891,Chicago,1879,"W. Le Baron, Jr., & Co.","The history of Edgar County, Illinois, containing a history of the County [by W. H. Perrin, H. H. Hill and A. A. Graham], Directory ... Illustrated",
1035031,London,1865,,"Cressy and Poictiers; or, the Story of the Black Prince's Page ... [Edited by S. O. Beeton.] Illustrated with numerous engravings, principally from designs by R. Dudley and G. Doré","EDGAR, John George."
1035091,London,1891,T. Fisher Unwin,"Ten years of Upper Canada in peace and war, 1805-1815; being the Ridout letters [edited] with annotations by M. E. Also an appendix of the narrative of the captivity among the Shawanese Indians, in 1788, of T. Ridout, etc","EDGAR, Matilda - Lady"
1035167,London,1888,Hurst & Blackett,Four Months' Cruise in a sailing yacht ... With illustrations,"EDGCUMBE, Ernestine Emma Horatia - Lady, and WOOD (Lady Mary Susan Felicie)"
1035193,London,1869,,"On the Edge of the Storm. By the author of “Mademoiselle Mori” [Miss Roberts], etc. New edition",
1035423,London,1896,Macmillan & Co.,Belinda ... Illustrated by C. Hammond. With an introduction by A. T. Ritchie: Single Works,"Edgeworth, Maria"
1035441,London,1895,381. Macmillan & Co.,Castle Rackrent and The Absentee ... With an introduction by Anne Thackeray Ritchie: Single Works,"Edgeworth, Maria"
1035517,London,1896,Macmillan & Co.,Helen ... Illustrated by C. Hammond. With an introduction by Anne Thackeray Ritchie: Single Works,"Edgeworth, Maria"
1035572,London,1895,Macmillan & Co.,Ormond. A tale ... Illustrated by C. Schloesser. With an introduction by Anne Thackeray Ritchie: Single Works,"Edgeworth, Maria"
1035589,London,1897,Macmillan and Co.,The Parent's Assistant ... Illustrated by Chris. Hammond. With an introduction by Anne Thackeray Ritchie: Single Works,"Edgeworth, Maria"
1035613,London,1895,Macmillan & Co.,Popular Tales ... Illustrated by ... C. Hammond. With an introduction by Anne Thackeray Ritchie: Single Works,"Edgeworth, Maria"
1038089,Edinburgh,1857,James Hogg,"Edinburgh dissected: including strictures on its institutions, legal, clerical, medical, educational, &c. To which are added, confessions and opinions of a Tory country gentleman: with a variety of anecdotical and other matter. In a series of letters addressed to Roger Cutlar, Esquire, by his nephew",
1038160,Edinburgh,1829,,"Notes relative to the fortified walls of Edinburgh; with a copy of the proclamation issued by the Town-Council, on receiving the news of the battle of Flodden. [By P. Neill. With MS. letter from to Lord II. Cockburn, and MS. note by the latter, prefixed.]",
1038214,Glasgow,1883,Privately printed,"A Scotish Pasquil from a ""Miscellaneous manuscrit circa 1630"" [entitled: ""To the pure Bretheren of Edinburgh."" Edited by A. S.]",
1038225,Edinburgh,1894,J. Thin,Some Edinburgh Shops. By the author of “Our Street” [J. Livingston],
1038398,London,1861,,"Edith the Captive; or, the Robbers of Epping Forest. By the author of “Jane Brightwell,” [i.e. J. M. Rymer.] etc",
1039492,London,1778,,"An Ode, addressed to the Scotch Junto, and their American Commission, on the late quarrel between Commissioner Ed[e]n [i.e. Lord Auckland] and Commissioner J[o]hnst[o]ne. With some digressive stanzas on the late political conduct of certain Ministerial Dependents and their Feeders. [A political satire.]",
1039585,Boston,1855,,History of the Capital of Asia and the Turks: together with an account of the domestic manners of the Turks in Turkey. [Edited by I. Edrehi. Illustrated.],"EDREHI, Moses."
1040079,Alnwick,1868,,"Burgh-on-the-Sands, Cumberland. Death of King Edward 1st, 7th July, 1307. (Monument of King Edward the First, etc.) [By W. Dickson.]",
1040107,London,1691,J. Hindmarsh,"King Edward the Third, with the fall of Mortimer, Earl of March. An historicall play [in five acts, prose, and verse, by J. Bancroft? With a dedication by W. Mountfort]",
1040305,Edinburgh,1883,Privately printed,"The County of Angus, 1678. (Translated from the original Latin.) [by the Rev. James Trail.] ... With map and preface. [The preface by J. M., i.e. John Macnair.] L.P","EDWARD, Robert - Minister of the Gospel at Murroes|EDWARD, Robert - Minister of the Gospel at Murroes"
1040619,London,1869,,"Susan Fielding. [A novel.] By the Author of “Archie Lovell.” [Mrs. A. Edwards.], etc","EDWARDS, Annie."
1041189,Boston,1899,"Little, Brown & Co.","The ' 98 Campaign of the 6th Massachusetts, U.S.V. ... With 79 illustrations, etc. [With an introduction by Curtis Guild.]","EDWARDS, Frank E."
1041402,London,1895,E. Stock,"The Works of the Rev. Griffith Edwards ... Edited by the Rev. Elias Owen, etc","EDWARDS, Griffith."
1043207,Dunfermline,1814,Printed for the author J. Miller,"Edwin and Emma: a pastoral tale, etc. [By David Black, in verse]",
1043208,Birmingham,1760,J. Baskerville,"Edwin and Emma [a poem, by D. Mallet]. (Extract of a letter from the curate of Bowes in Yorkshire, on the subject of the poem by David Black.)",
1043612,Albany,1893,J. Munsell's Sons,"The German Allied Troops in the North American War of Independence, 1776-1783. Translated and abridged from the German ... by J. G. Rosengarten","EELKING, Max von."
1043613,Meiningen,1863,,Geschichte des Herzoglich Sachsen-Meiningischen Contingents,"EELKING, Max von."
1043971,Woodbridge,1812,"S. Loder, R. Baldwin","Metrical Effusions, or verses on various occasions. [By Bernard Barton]",
1044120,St. Petersburg,1867,,Матерілы для исторіи Русской Литературы,"EFREMOV, Petr Aleksandrovich."
1044976,Oswestry,1885,Woodall & Co.,"Talbot's Tomb, in the parish church of St. Alkmund's, Whitchurch, Shropshire","EGERTON, William Henry."
1045857,London,1875,,"Eglantine. By the author of “St Olave's,” “Janita's Cross,” etc. [Eliza Tabor, afterwards Stephenson.]",
1045858,London,1876,,"A Voice from the Sea; or, the Wreck of the Eglantine. By the author of “Margery's Christmas Box.” With a preface by S. Plimsoll",
1046921,London,1838,,"The imagery of Foreign Travel; or, descriptive extracts from scenes and impressions in Egypt, India, etc. Selected and republished by the author [M. Sherer]: Appendix",
1046942,London,1844,,"Notes from a private journal of a visit to Egypt and Palestine, by way of Italy and the Mediterranean. [By Lady Montefiore]: Appendix",
1046957,London,1824,,"Scenes and Impressions in Egypt and Italy. By the author of Sketches of India, and Recollections of the Peninsula. [J. M. Sherer.]: Appendix",
1047253,Bremen,1863,,"Bremisches Urkundenbuch ... herausgegeben von D. R. E. Bd. 1. Lief. 1-3. (Von D. R. E. und W. v. Bippen. Bd. 1. Lief. 4, etc.)","EHMCK, Diedrich Rudolf."
1047382,Zürich,1890,,"In die Vogesen! ... Mit 68 Bildern von J. Weber, etc","EHRENBERG, Fritz."
1050932,Eisleben,1882,,"Chronicon Islebiense. Eisleben Stadt-Chronik aus den Jahren 1520-1738. Nach der Urschrift, mit erklärenden Anmerkungen und einem Ortsregister, herausgegeben von ... H. Grössler ... und F. Sommer, etc",
1053224,London,1774,,"A new musical Interlude, called the Election. [By M. P. Andrews.]",
1053225,London,1780,,"[A new musical Interlude, called the Election. [By M. P. Andrews.]]",
1053415,London,1765,J. Dodsley,An Elegy written among the ruins of an Abbey. By the author of the Nun [E. Jerningham],
1053422,London,1756,,"[An Elegy written in an Empty Assembly-Room ... The second edition. [A parody of Pope's ""Eloisa to Abelard."" By Richard O. Cambridge.]]",
1055280,Franz Duncker,1861,Berlin,Die Mühle am Floss ... Uebersetzt von Julius Frese: The Mill on the Floss,"Eliot, George"
1055401,Harper & Bros,1883,New York,Character readings from “George Eliot”. Selected and arranged by Nathan Sheppard: Extracts,"Eliot, George"
1056108,London,1863,,"The Story of Elizabeth. [A novel. By Miss I. Thackeray, afterwards Ritchie. Reprinted from the “Cornhill Magazine.”] With two illustrations",
1056110,London,1867,,"[The Story of Elizabeth. [A novel. By Miss I. Thackeray, afterwards Ritchie. Reprinted from the “Cornhill Magazine.”] With two illustrations.]",
1056165,London,1829,,"The most pleasant song of Lady Bessy, the eldest daughter of ... Edward the fourth; and how she married King Henry the Seventh, etc. With notes by I. Heywood",
1057901,London,1896,Theosophical Publishing Society,"The Story of Atlantis. A geographical, historical, and ethnological sketch. Illustrated by four maps of the world's configuration at different periods ... With a preface by A. P. Sinnett","ELLIOT, William Scott."
1057935,Selkirk,1893,G. Lewis & Son,"The Country and Church of the Cheeryble Brothers [i.e. Ramsbottom in Lancashire, the home of William and Daniel Grant, the “Cherryble Brothers” of Dickens' “Nicholas Nickleby”]","ELLIOT, William Hume."
1058364,London,1875,Reprinted from “The Field” for private circulation,"The Fauna of the Prybilov Islands. Abridged from the “Report on the Prybilov Group or Seal Islands of Alaska,” by Henry W. Elliott ... By J. E. Harting","ELLIOTT, Henry Wood."
1058577,London,1835,"H. Fisher, R. Fisher & P. Jackson","Views in India, China, and on the Shores of the Red Sea: drawn by Prout, Stanfield, Cattermole, Purser, Cox, Austen, &c. from original sketches by Commander R. Elliott ... With descriptions by Emma Roberts","ELLIOTT, Robert - Commander, R.N"
1059387,Philadelphia,1887,H. Harrison & Co.,"The Camp-Fires of General Lee from the Peninsula to Appomattox Court-House, etc","Ellis, Edward Sylvester"
1059442,London,1896,"Ward, Lock & Bowden","The People's Standard History of the United States from the landing of the Norsemen to the present time. By E. S. Ellis ... Assisted by, with introduction, annotations, lists of authorities, etc., G. M. Adam","Ellis, Edward Sylvester"
1059658,London,1826,J. Murray,"The true history of the State Prisoner commonly called the Iron Mask [here identified with Count E. A. Mattioli], extracted from documents in the French archives. [With an appendix.]","ELLIS, George James Welbore Agar - Baron Dover"
1059974,Newcastle,1850,Privately printed,"A Genealogy of the family of Radclyffe, of Dilston, in Northumberland. [With preface by John Fenwick.]","ELLIS, James - of Newcastle-on-Tyne"
1059975,Newcastle,1850,G. B. Richardson,"Letters between J. Ellis, esq. and Walter Scott, esq. [Edited by J. F., i.e. J. Fenwick.]","ELLIS, James - of Newcastle-on-Tyne"
1061535,London,1830,Jones & Co.,"Metropolitan Improvements ... From original drawings by T. H. Shepherd, etc","ELMES, James."
1061536,London,1847,,"[Metropolitan Improvements ... From original drawings by T. H. Shepherd, etc.]","ELMES, James."
1061623,London,1855,,The House of Elmore: a Family History. [By F. W. Robinson.],
1062196,Rugby,1884,A. P. Smith,"Lecture notes on physical geography and geology, etc","ELSDEN, James Vincent - and LOWE (Walter Bezant)"
1063831,London,1876,,"A history of the castles, mansions and manors of Western Sussex. By D. G. C. E. ... assisted by ... C. J. Robinson. ... With ... illustrations, etc","ELWES, Dudley George Cary."
1064116,York,1862,,"Journal of A. E., a prisoner of War in Richmond. Edited by C. Lanman","ELY, Alfred - Member of Congress"
1064289,Newcastle,1834,,"[The Boke named the Gouernour deuised by Sir T. E., knyght. B.L. Few MS. notes.]: The boke named the Governour","ELYOT, Thomas - Sir"
1065269,London,1857,,"The Militiaman at home and abroad; being the history of a Militia regiment from its first training to its disembodiment; with sketches of the Ionian Islands, Malta, and Gibraltar ... With illustrations by John Leech",
1066325,London,1852,,The Emigrant's Handbook; being a guide to the various fields of emigration in all parts of the Globe. [By J. Cassell.],
1067555,Bath,1828,J. Upham,Employment. [Poems translated by F. Page from the German of Schiller and Goethe.],
1067912,Paris,1867,,"L'Amérique centrale et méridionale. Dessins de MM. L. Noel, Lebreton et G. Janet, etc","ÉNAULT, Louis."
1067944,Paris,1863,,"La Méditerranee, ses îles et ses bords ... Illustrations de MM. Rouargue frères","ÉNAULT, Louis."
1070932,London,1880,Macmillan & Co.,Enga. [A novel.] By the author of “The Harbour Bar” [i.e. Lady Prestwich.],
1071733,Westminster,1899,Archibald Constable & Co.,[Русскій сѣверъ. Путевыя записки.] A Russian Province of the North ... Translated from the Russian by H. Cooke. With illustrations ... and three maps,"ENGEL'GARDT, Aleksandr Platonovich."
1072720,London,1856,E. Stanford,"Engineers and Officials; an historical sketch of the progress of “Health of Towns Works” (between 1838 and 1856) in London and the Provinces. With biographical notes on Lord Palmerston, the Earl of Shaftesbury, Lord Ebrington, E. Chadwick, C.B., F. O. Ward, J. Thwaites",
1140593,London,1879,Marcus Ward & Co.,"Our Native Land, its scenery and associations. A series of 36 water-colour sketches after Rowbotham, Read, Needham, and other eminent artists. With descriptive notes. [The author of the text identified on the wrapper of pt. 1 as “the author of By Loch and by Land”, i.e. Jean L. Watson.]",
1142434,London,1812,Robert Triphook,England's Helicon. [Probably edited by Nicolas Ling.] A collection of pastoral and lyric poems first published at the close of the reign of Q. Elizabeth,
1144078,Indianapolis,1896,Bowen-Merrill Co.,"Conquest of the Country Northwest of the River Ohio, 1778-1783, and life of Gen. George Rogers Clark. Over one hundred and twenty-five illustrations. With numerous sketches of men who served under Clark, etc","ENGLISH, William Hayden."
1144649,Köln,1860,,Quellen zur Geschichte der Stadt Köln ... Herausgegeben von ... L. E. ... und ... G. C,"ENNEN, Leonard - and ECKERTZ (Gottfried)"
1144810,Strasbourg,1839,,"Dictionnaire général de Géographie universelle ancienne et moderne, historique, politique, littéraire et commerciale ... Accompagné d'une introduction à l'étude de la géographie dans ses rapports avec l'histoire, par C. Cuvier, etc","ENNERY, Jonas - and HIRTH ( )"
1152774,Leeds,1862,J. Heaton & Son,"Tommy Toddles's Comic Almenak, for all't foaks e Leeds (e t' Wurld) an raand abaght (for 1862, 1863-69, 1870-74) ... Be Tommy Toddles, Eesquear",
1153273,London,1769,,"The Ephesian Matron. A comic serenata, after the manner of the Italian. [In one act and in verse. By I. Bickerstaffe.]",
1153730,Edinburgh,1757,,"The Epigoniad. A poem, in nine books. [By W. Wilkie.]",
1153939,London,1870,,"Episodes of Fiction; or, choice stories from the great novelists: with biographical introductions and ... illustrations ... engraved ... by R. Paterson",
1153962,London,1717,,An Epistle from a Lady in England to a Gentleman at Avignon. [By T. Tickell. In verse.],
1153986,London,1753,Printed for the author,"An Epistle to a Lady, concerning some important and necessary truths in religion. [In verse. By W. Dodd.]",
1154267,London,1827,Printed by J. L. Cox,"Rambles in Waltham Forest. A stranger's contribution to the triennial sale for the benefit of the Wanstead Lying-in Charity. [A poem sometimes attributed to Marguerite Gardiner, Countess of Blessington. With plates “drawn on stone by C. M. H.”, which according to the preface may be the author's initials.]",
1154397,Epsom,1825,,"Some particulars relating to the history of Epsom, containing a description of the origin of horse-racing, and of Epsom Races. To which is added an Appendix, containing a botanical survey of the neighbourhood. [By H. Pownall.]",
1155858,London,1899,Dunbar Bros.,"Prinsloo of Prinsloosdorp: a tale of Transvaal officialdom. Being incidents in the life of a Transvaal official, as told by his son-in-law, Sarel Erasmus, [By Douglas Blackburn]","ERASMUS, Sarel."
1155933,Leipzig,1880,,"Die geographischen Fragmente des Eratosthenes, neu gesammelt, geordnet und besprochen von Dr. H. Berger",
1156103,Pragae,1855,,"Regesta diplomatica nec non epistolaria Bohemiae et Moraviae Pars 1. ... opera Caroli J. Erben (Pars 2-4, opera Josephi Emler)","ERBEN, Karel Jaromír."
1156265,London,1879,"S. Low, etc.","Erchomenon, or the Republic of Materialism. [A novel.] By **** [i.e. H. C. M. Watson.]",
1157569,London,1872,,Erewhon (Nowhere); or Over the Range. [By Samuel Butler.],
1159150,Paris,1811,,[Promenade ou Itinéraire des Jardins d'Ermenonville: auquel on a joint vingt-cinq de leurs principales vues dessinées et gravées par Mérigot fils.],
1160743,London,1876,Hurst & Blackett,Ersilia. [A novel.] By the author of “My Little Lady” [i.e. Eleanor F. Poynter],
1160879,Edinburgh,1843,T. G. Stevenson,"Extracts from the Diary of a Senator of the College of Justice. M.DCC.XVII-M.DCC.XVIII. [The editor's “Memoir of Lord Grange” signed: J. M., i.e. James Maidment.]","ERSKINE, James - Lord Grange"
1161718,Calcutta,1879,"Thacker, Spink & Co.","The Commerce and Navigation of the Erythræan Sea; being a translation of the Periplus Maris Erythræi, by an anonymous writer, and of Arrian's account of the Voyage of Nearkhos ... With introductions, commentary, notes and index. By J. W. McCrindle ... Reprinted, with additions, from the Indian Antiquary",
1162017,Madrid,1864,,Historia y descripcion de Mejico,"ESCALERA, Evaristo - and GONZALEZ LLANA (Manuel)"
1162093,Paris,1884,,"Histoire et géographie de Madagascar. Nouvelle édition, enrichie d'une carte de M. A. Grandidier","ESCAMPS, Henry d'."
1162147,Montevideo,1872,,"Buenos-Aires á vuelo de pájaro. Reseña estadística y descriptiva con ... notas ... sobre la República Argentina. Buenos-Aires à vol d'oiseau, etc. [With a prefatory letter by J. F. Lopez.] Span. & Fr","ESCARDÓ, Florencio - of Buenos Aires"
1162303,Saintes,1876,,"Études, documents, et extraits relatifs à la ville de Saintes, publiès par M. le Baron E. [Edited, with a preface, by L. Audiat.]","ESCHASSÉRIAUX, René François Eugène - Baron"
1162497,Zürich,1870,,"Memorabilia Tigurina, oder Chronik der Denkwürdigkeiten des Kantons Zürich 1850 bis 1860, etc. (Eine Fortsetzung der ... memorabilia Tigurina ... von F. V.)","ESCHER, G. von."
1164123,Buenos Aires,1873,,"Recuerdos históricos.-San Martin y Bolívar. Entrevista de Guayaquil, 1822, etc. (Sinopsis de la vida del autor. [Edited by A. J. Carranza.]","ESPEJO, Gerónimo - General"
1164493,Riom,1899,,"La Coalition d'Auvergne, avril 1791. Carnet du comte d'Espinchal. [Edited, with introduction and notes, by J. M. de Champflour.]","ESPINCHAL, Joseph Thomas d' - Count"
1165041,London,1861,,The English at Home ... Translated and edited by L. Wraxall,"ESQUIROS, Alphonse."
1165042,London,1862,,Second series: The English at Home ... Translated and edited by L. Wraxall,"ESQUIROS, Alphonse."
1165043,London,1863,,Third series: The English at Home ... Translated and edited by L. Wraxall,"ESQUIROS, Alphonse."
1165057,Bogotá,1855,,Historia de los Montañeses. Traductor I. A. de Plaza,"ESQUIROS, Alphonse."
1165798,London,1872,,"Essays. By the author of “Véra,” etc. [i.e. Miss C. L. H. Dempster.]",
1166192,London,1677,,"Tom Essence, or the Modish Wife. A comedy [in five acts and in prose, by T. Rawlins]","ESSENCE, Tom."
1166847,Berlin,1802,,"Reisen der Spanier nach der Südsee insbesondere nach der Insel O-Taheité. Jetzt zum erstenmal aus dem Spanischen [of P. Estala's “Viagero Universal,” Tl. 17] übersetzt. Herausgegeben, mit Anmerkungen und mit einer historischen Schilderund der Gesellschafts-Inseln begleitet, von Fr. Wilh. Aug. Bratring. Mit einer Karte","ESTALA, Pedro."
1167756,London,1818,,"Familiar Lectures on Moral Philosophy. [With a memoir of the author, by Mrs. Barbauld.]","ESTLIN, John Prior."
1168365,Birmingham,1788,,"A poetic epistle from G. D.'E. to Henry the Fourth. [A partial translation from the French of Blinde Sainmore?] by Anthony Pasquin Esq. [pseud., i.e. J. Williams.]","ESTRÉES, Gabrielle d' - Duchess de Beaufort"
1168831,London,1848,G. Purkess,"Ethelinde: or the Fatal Vow. A romance. By the author of “Ela the Outcast,” etc. [i.e. Thomas Peckett Prest.]",
1169570,Eton],1898,R. Ingalton Drake,A Distant Prospect of Eton College. [By T. B. Carter. With a map.],
1169627,Windsor,1819,Knight & Son,"Poetry of the College Magazine. [The editors preface signed: W. B., i.e. Walter Blunt?]",
1169717,Cambridge,1846,,The Legacy of an Etonian; edited by R. Nolands,
1171024,Paris,1869,,"Recueil des fragments historiques sur les derniers Valois, Henri II., François II., Charles IX., Henri III., (1547 à 1589), précédés de notes par A. E. du G","EUDEL DU GORD, Armand."
1171294,London,1737,R. Dodsley,"Eugenio; or, Virtuous and happy life. A poem, etc. [By Thomas Beach.]",
1173260,Leipzig,1862,,Handbuch der Geographie und Statistik von West- und Süd-Europa. Von Dr. M. Willkomm ... Dr. X. Heuschling ... Dr. M. Block ... Dr. H. F. Brachelli,
1173354,London,1874,,"Picturesque Europe. Containing ... engravings of views of its most interesting scenery. First series. (The Beauties of the Bosphorus; by Miss Pardoe, from drawings by W. H. Bartlett.)",
1173400,Auckland,1853,,Recollections of a visit to Europe in 1851 and 1852. By a Traveller from New Zealand [D. Rough],
1174847,London,1860,J. D. Potter,"Euryalus; Tales of the sea, a few leaves from the diary of a midshipman. [By William Chimmo. With plates.]",
1176030,"] Barth, printer, Wych Street, Strand",1866,[London,"[Evans's Supper Rooms, Covent-Garden. Selection and words of madrigals, glees ... sung ... in the above Supper-Rooms, etc.]",EVANS - Hotel-Keeper
1176353,London,1864,,"Macaria, etc. [A novel.]","EVANS, afterwards WILSON, Augusta Jane."
1178092,London,1811,,"The New Geographical Grammar ... Comprehending a copious ... account of ... Europe, Asia, Africa and America ... To which is prefixed, a concise System of Astronomical Geography, by J. Ferguson","EVANS, John - LL.D., of Islington"
1178475,London,1897,E. Stock,Dies Dominica: being hymns and metrical meditations for each Sunday in the natural year. By M. Evans and I. Southall,"EVANS, Margaret - of Oxford"
1179380,Halstead,1886,W. J. Evans,Old and New Halstead. [With a preface by J. R. Vaizey.],"Evans, William James."
1179824,London,1851,E. Lloyd,"Evelina, the Pauper's Child: or Poverty, crime, and sorrow. A romance ... by the author of “Ela the Outcast” [i.e. Thomas Peckett Prest], etc. [With illustrations.]",
1180684,London,1853,,An address delivered before the New York Historical Society ... With an introduction by the Hon J. R. Ingersoll,"EVERETT, Edward."
1183667,York,1868,,Mathieu Ropars; etcetera. By an Ex-Editor [William Young?],
1184259,Dublin,1848,Hodges & Smith,"Glendalough, or the Seven Churches: a didactic poem. By an Ex-Moderator, T.C.D",
1184401,London,1864,,"Expeditions on the Glaciers: including an ascent of Mont Blanc, Monte Rosa, Col du Géant, and Mont Buét. By a Private of the thirty eighth Artists', and Member of the Alpine Club [J. Barrow. Reprinted from “Colburn's New Monthly Magazine”]",
