Identifier,Place of Publication,Date of Publication,Publisher,Title,Author
206,London,1879,S. Tinsley & Co.,Walter Forbes. [A novel.] By A. A,A. A.
216,London,1868,Virtue & Co.,"All for Greed. [A novel. The dedication signed: A. A. A., i.e. Marie Pauline Rose, Baroness Blaze de Bury.]","A., A. A."
218,London,1869,"Bradbury, Evans & Co.","Love the Avenger. By the author of “All for Greed.” [The dedication signed: A. A. A., i.e. Marie Pauline Rose, Baroness Blaze de Bury.]","A., A. A."
472,London,1851,James Darling,"Welsh Sketches, chiefly ecclesiastical, to the close of the twelfth century. By the author of “Proposals for Christian Union” (E. S. A. [i.e. Ernest Appleyard])","A., E. S."
480,London,1857,Wertheim & Macintosh,"[The World in which I live, and my place in it. By E. S. A. [i.e. Letitia Willgoss Stone.] Edited by ... J. H. Broome.]","A., E. S."
481,London,1875,William Macintosh,"[The World in which I live, and my place in it. By E. S. A. [i.e. Letitia Willgoss Stone.] Edited by ... J. H. Broome.]","A., E. S."
519,London,1872,The Author,Lagonells. By the author of Darmayne (F. E. A. [i.e. Florence Emily Ashley]),"A., F. E."
874,London,1676,,"A Warning to the inhabitants of England, and London in particular ... By M. A. [i.e. Mary Adams.]",Remaʿ.
1143,London,1679,,A Satyr against Vertue. (A poem: supposed to be spoken by a Town-Hector. [By John Oldham. The preface signed: T. A.]),"A., T."
1280,Coventry,1802,Printed by J. Turner,"An Account of the many and great Loans, Benefactions and Charities, belonging to the City of Coventry ... A new edition. [The dedication signed: AB, CD, EF, GH, &c. By Edward Jackson and Samuel Carte.]",
1808,Christiania,1859,,"Erindringer som Bidrag til Norges Historie fra 1800-1815. Anden Udgave ... Udgivet med nogle Rettelser og Tillæg af Christian C. A. Lange. Med Forfatterens Portraet, og hans Biographi af Amtmand J. C. Aall","AALL, Jacob."
1905,Firenze,1888,,Gli Studi storici in terra d'Otranto ... Frammenti estratti in gran parte dall' Archivio Storico Italiano ... a cura e spese di L(uigi) G(iuseppe) D(e) S(imone),"AAR, Ermanno - pseud. [i.e. Luigi Giuseppe Oronzo Mariano Raffaele Francesco Fortunato Felice de Simone.]"
1929,Amsterdam,1839,,De Aardbol. Magazijn van hedendaagsche land- en volkenkunde ... Met platen en kaarten. [Deel 4-9 by P. H. W.],
2836,Savona,1897,,Cronache Savonesi dal 1500 al 1570 ... Accresciute di documenti inediti pubblicate e annotate dal dott. G. Assereto,"ABATE, Giovanni Agostino."
2854,London,1865,E. Moxon & Co.,"See-Saw; a novel ... Edited [or rather, written] by W. W. Reade","ABATI, Francesco."
2956,Paris,1860,,"Géodésie d'une partie de la Haute Éthiopie, revue et rédigée par R. Radau. fasc. 1-3","ABBADIE, Antoine Thompson d'."
2957,Paris,1873,,[With eleven maps.],"ABBADIE, Antoine Thompson d'."
3017,Puerto-Rico,1866,,"[Historia geográfica, civil y politica de la Isla de S. Juan Bautista de Puerto Rico, Dala a luz A. Valladares de Sotomayor.]","ABBAD Y LASIERRA, Agustín Íñigo - Bishop of Barbastro"
3131,York,1899,W. Abbatt,"The Crisis of the Revolution, being the story of Arnold and André now for the first time collected from all sources, and illustrated with views of all places identified with it ... Illustrations from original photographs by E. S. Bennett, etc","ABBATT, William."
4598,Hull,1814,The Author,Peace: a lyric poem. [With prefatory address by F. Wrangham?],"ABBOTT, Thomas Eastoe."
4884,London,1820,J. Hatchard & Son,"Abdallah; or, The Arabian Martyr: a Christian drama, in three acts. [In verse.] [By Thomas Foster Barham, the Elder.]",
4976,Oxonii,1800,"J. Cooke, etc.",[Abdollatiphi Historiæ Ægypti compendium. [With a Latin version by Edward Pocock the younger.] Arab. & Lat.],
5382,London,1847,Punch Office,"The Comic History of England ... With ... coloured etchings, and ... woodcuts, by John Leech","A'BECKETT, Gilbert Abbott."
5385,London,1897,"Bradbury, Agnew & Co.","[The comic history of England ... With twenty coloured etchings, and two hundred woodcuts. By John Leech.]","A'BECKETT, Gilbert Abbott."
5389,London,1897,"Bradbury, Agnew & Co.",[The Comic History of Rome ... Illustrated by John Leech.],"A'BECKETT, Gilbert Abbott."
5432,Milano,1893,,Signa: opera in tre atti [founded on the novel entitled: “Signa” by Ouida] ... Traduzione ritmica di G. Mazzucato,"A'BECKETT, Gilbert Arthur - and RUDALL (H. A.)"
6036,London,1805,C. & R. Baldwin,"The Venetian Outlaw, a drama in three acts ... Translated [from the French translation of J. H. D. Zschokke's “Abällino, oder der grosse Bandit”] and adapted to the English stage by R. W. Elliston",
6821,Aberdeen,1837,J. Davidson & Co.,Description of the Coast between Aberdeen and Leith. [By William Duncan.]: Appendix,
7521,Wien,1896,,Aus Kaukasischen Ländern. Reisebriefe von H. Abich. Herausgegeben von dessen Witwe (A. Abich),"ABICH, Wilhelm Hermann."
7630,Abingdon,1898,W. H. Hooke,Selections from the Municipal Chronicles of the Borough of Abingdon from A.D. 1555 to A.D. 1897. Edited by B. Challenor,
8239,Quebec,1899,L. J. Demers & Frère,"The Plains of Abraham, 1759, a spot sacred to the memory of Wolfe and Montcalm. An appeal to all Canada for the preservation of the Plains of Abraham as portion of the public domain",
8435,London,1892,Effingham Wilson & Co.,The Witwatersrand Gold Mines. A true and unvarnished account of their origin and progress ... Translated ... by H. C. Simonsen,"ABRAHAM, Félix - Writer on Mining"
8440,London,1894,Effingham Wilson,The New Era of the Goldmining Industry in the Witwatersrand ... Translated from the German by H. C. Simonsen. With an authentic map of the fields,"ABRAHAM, Félix - Writer on Mining"
11361,Leipzig,1894,,"Tirol und Vorarlberg ... Mit ... einer Karte, zahlreichen Illustrationen, etc","ACHLEITNER, Arthur - and UBL (E.)"
13074,London,1899,W. Thacker & Co.,"A Summer in High Asia: being a record of sport and travel in Baltistan and Ladakh ... With an appendix on Central Asian trade by Capt. S. H. Godfrey ... Illustrated from drawings by the author, photographs, and a map of the route","ADAIR, Frederick Edward Shafto."
13364,London,1885,"Griffith, Farran & Co.","A Hand-book and History of Sidmouth from the Triassic period up to “Now.” By אדם [Adam, i.e. P. O. Hutchinson]. Illustrated ... With map",
14466,London,1860,Adams & King,"The Historie of Eald Street, now called Old Street, with memoranda of the Parish of St. Luke and of the Chartreuse",
14703,1845,1846,,First (-Third) Annual Report on the Geology of the State of Vermont,
15141,London,1893,T. Fisher Unwin,The New Egypt. A social sketch. [Edited by J. W. Longsdon.],"ADAMS, Francis William Lauderdale."
15146,London,1894,T. Fisher Unwin,Tiberius: a drama ... With introduction by W. M. Rossetti,"ADAMS, Francis William Lauderdale."
16173,enk,1817,"printed by W. Thorne, and published by J. Callow; J. Hunter; and J. Ridgway","Memoirs of the Life and Doctrines of the late John Hunter, Esq., etc","ADAMS, Joseph - M.D., F.L.S"
16543,London,1816,John Murray,"The Narrative of Robert Adams, a sailor, who was wrecked on the Western Coast of Africa, in the year 1810 ... With a map, etc. [Edited by S. Cock.]","Adams, Robert - Sailor"
16544,Boston,1817,Wells & Lilley,"[The Narrative of Robert Adams, a sailor, who was wrecked on the Western Coast of Africa, in the year 1810 ... With a map, etc. [Edited by S. Cock.]]","ADAMS, Robert - Sailor"
17602,London,1897,J. Bowden,East End Idylls ... With an introduction by the Hon. and Rev. J. G. Adderley,"Adcock, Arthur St. John"
17752,Upsaliæ,1833,,"Acta historiam regis Chistierni II. illustrantia. Quae ... præside mag. Erico Gust. Geijer ... pro gradu philosophico p.p. P. A. Adde, etc","ADDE, Petrus Adolphus."
18173,London,1804,Vernor & Hood,"[The Works of the late Right Honourable Joseph Addison, Esq. ... The third edition, etc. [Edited by Thomas Tickell.]]: Works","ADDISON, Joseph - Right Hon"
18218,Edinburgh,1859,James Nichol,The Poetical Works of Joseph Addison; Gay's Fables; and Somerville's Chase. With memoirs and critical dissertations by Rev. George Gilfillan: Two or more Works,"Addison, Joseph"
18347,Yverdon,1777,,"L'Esprit d'Addisson, ou les Beautés du Spectateur, du Babillard et du Gardien, consistant principalement dans une collection des feuilles de Mr. Addisson, avec un précis de sa vie. Ouvrage nouvellement traduit de l'anglais par Mr. J. P. A: Essays from the Spectator, Guardian and Tatler","ADDISON, Joseph - Right Hon"
18469,Londini,1799,F. & C. Rivington,"Addisoni Epistola missa ex Italiâ ad illustrem Dominum Halifax, anno 1701. [A translation into Latin hexameter verse.] Auctore A. Murphy. (Addison's Letter to Lord Halifax.) Lat. & Eng: Miscellaneous Single Works","ADDISON, Joseph - Right Hon"
19340,St. Petersburg,1827,,"Augustin Freiherr von Meyerberg und seine Reise nach Russland. Nebst einer von ihm auf diese Reise veranstalteten Sammlung von Ansichten, Gebräuchen, Bildnissen u. s. w","ADELUNG, Friedrich von."
20207,Berlin,1866,,Studien zur Cultur-Geschichte Polens. Bd. 1,"ADLER, Carl - Writer on Poland"
20960,London,1853,Addey & Co.,"The Diary and Houres of the Ladye Adolie, a faythfulle childe. 1552. [Edited, or rather written, by Lady C. M. Pepys.]",
21119,London,1874,Chapman & Hall,"Lays of Modern Oxford, by Adon. Illustrated by M. E. Edwards, F. Lockwood, and the author",
21430,London,1790,J. Johnson,"Adriano; or, the first of June, a poem. By the author of The Village Curate [i.e. James Hurdis]",
21782,London,1817,J. Johnston,"The Adventures of a Post Captain. By a Naval Officer. [In verse.] With ... engravings, by Mr. Williams",
22060,Sceaux,1883,,"Histoire de la Ville de Sceaux depuis son origine jusqu'à nos jours ... Sous la direction de ... M. Charaire ... Ouvrage illustré de gravures, etc","ADVIELLE, Victor."
22105,London,1795,J. Debrett,"The National Advocates, a poem. Affectionately inscribed to the Honourable Thomas Erskine and Vicary Gibbs, Esquire [in praise of their exertions in defence of Thomas Hardy, Horne Tooke and others]. [By William Hayley.]",
22278,Coblenz,1865,,Das Hochgebirge von Grindelwald. Naturbilder aus der schweizerischen Alpenwelt von C. Aeby und E. v. Fellenberg ... und Gerwer. Mit ... einer Karte in Farbendruck von R. Leuzinger,"AEBY, Christoph."
23565,London,1877,Chatto & Windus,Prometheus the Fire-giver. An attempted restoration of the lost first part of the Prometheian Trilogy of Æschylus. [By William Cox Bennett.]: Appendix,Aeschylus.
24344,Leipzig,1853,,"Cosmographiam Æthici Istrici ab Hieronymo ex Graeco in Latinum breviarium redactam ... separato libello expressam primum edidit Henricus Wuttke. Accedunt duae tabulae, etc",
24878,London,1886,Hodder & Stoughton,"The Children of Africa. Written for all English-speaking children. By ... the author of “The Children of India,” etc. [i.e. A. W. Marston]",
27797,London,1834,William W. Clowes,"Prospectus of an Expedition into the Interior of South Africa from Dalagoa Bay, etc. [By W. D. Cooley.]: General Appendix",
28615,Stockholm,1852,,"Försök till en statsekonomisk statistik öfver Sverige. (Den statsekonomiska afdelningen af C. A. Agardh, den statistiska af C. E. Ljungberg.)","Agardh, C. A. (Carl Adolf)"
28630,Carlstad,1857,,Inledning till Sveriges fysiska geografi. Jemte upplysningar rörande ankologisk och fysisk karta öfver Sverige,"Agardh, C. A. (Carl Adolf)"
28758,Boston,1866,Ticknor & Fields; J. R. Osgood,"Geological Sketches. [The preface signed: E. C. A., i.e. Elizabeth C. Agassiz. With a portrait.]","Agassiz, Louis"
28784,Paris,1869,,"Voyage au Brésil, traduit de l'anglais ... par F. Vogeli. Ouvrage illustré, etc","Agassiz, Louis"
28873,London,1853,Chapman & Hall,"Agatha's Husband. A novel. By the author of “Olive,” etc. [i.e. D. M. Mulock, afterwards Craik.]",
28876,London,1875,Macillan & Co.,"[Agatha's Husband. A novel. By the author of “Olive,” etc. [i.e. D. M. Mulock, afterwards Craik.]]",
29031,London,1827,William Carpenter,The Age Reviewed: a satire. [In verse. By Robert Montgomery.],
29032,London,1828,W. C. Wright,[The Age Reviewed: a satire. [In verse. By Robert Montgomery.]],
29285,London,1876,Chapman & Hall,Through the Ages. A psychological romance. By the author of “The Honeymoon” [i.e. the Duke de Medina Pomar],
29505,A. Millar,1758,London,"Agis: a tragedy, etc. [In verse. By John Home.]",
29844,York,1846,"Leavitt, Trow & Co.",The Gem of the Season: with twenty plates by Sartain. Edited by J. H. Agnew,"AGNEW, John Holmes."
30269,Allahabad,1880,,"Mathurá: a District Memoir. By F. S. Growse ... Second edition. Illustrated, revised and enlarged: Miscellaneous Official Publications",
31858,London,1823,G. & W. B. Whittaker,"Ahasuerus, the Wanderer; a dramatic legend [in verse] ... By the author of Sketches in Hindoostan, and other poems [i.e. Thomas Medwin]",
32896,Stuttgart,1887,,Skandinavische Hof- und Staatsgeschichten des neunzehnten Jahrhunderts. Nach den schwedischen Quellen des Dr. A. Ahnfelt von H. Martens,"AHNFELT, Arvid."
33745,London,1825,Longman & Co.,The Works of Anna Lætitia Barbauld. With a memoir by Lucy Aikin,"AIKIN, afterwards BARBAULD, Anna Laetitia."
33833,D. Appleton & Co,1850,New York,The Vicar of Wakefield ... Illustrated with numerous engravings. With an account of the author's life and writings by J. Aikin: The Vicar of Wakefield,"Goldsmith, Oliver"
33881,London,1810,R. H. Evans,[Essays on song-writing: with a collection of such English songs as are most eminent for poetical merit. To which are added some original pieces. [By J. Aikin.]],"AIKIN, John - M.D"
34361,Санктпетербургъ,1889,,Кіево-Софійскій Соборъ. Изслѣдованіе древней мозаической и фресковой живописи ... Съ 14 рисунками. (Оттискъ изъ „Записокъ Импер. Русск. Археол. Общ.” т. iv.) [With manuscript addenda in English.],"AINALOV, Dmitry Vlas'evich - and REDIN (Egor Kuz'mich)"
34463,London,1872,J. Maxwell & Co.,"Robert Ainsleigh. By the author of 'Lady Audley's Secret,' etc. [i.e. Mary E. Braddon]","AINSLEIGH, Robert."
34538,Paisley,1892,Alexander Gardner,"A Pilgrimage to the Land of Burns, and Poems ... With a memoir of the author, by Thomas C. Latto. [With portraits.]","AINSLIE, Hew."
34785,London,1860,J. Maxwell & Co.,The illustrated universal gazetteer,
34793,London,1872,C. Griffin & Co.,"Wanderings in every Clime; or, voyages, travels, and adventures all round the world ... A sequel to “The Earth delineated with pen and pencil” ... With ... illustrations, etc","AINSWORTH, William Francis."
34810,London,1872,Tinsley Bros.,"Boscobel; or, the Royal Oak. A tale of the year 1651 ... Illustrated by J. H. Rimbault","Ainsworth, William Harrison"
34826,London,1861,Chapman & Hall,The Constable of the Tower: an historical romance ... Illustrated by John Gilbert,"Ainsworth, William Harrison"
34852,London,1874,G. Routledge & Sons,"[The Flitch of Bacon: or, the Custom of Dunmow. A tale of English home. With illustrations by John Gilbert.]","Ainsworth, William Harrison"
34914,London,1858,G. Routledge & Co.,Mervyn Clitheroe ... Illustrated by Hablot K. Browne,"Ainsworth, William Harrison"
34952,London,1860,"Routledge, Warne & Routledge",Ovingdean Grange. A tale of the South Downs. Illustrated by Hablot K. Browne,"Ainsworth, William Harrison"
34967,London,1857,G. Routledge & Co.,[Rookwood ... The fourth edition ... with illustrations by George Cruikshank. [With a portrait.]],"Ainsworth, William Harrison"
34987,London,1857,G. Routledge & Co.,The Spendthrift: a tale ... With illustrations by Hablot K. Browne,"Ainsworth, William Harrison"
36171,Paris,1896,,L'Auvergne. Illustrations de A. Montader,"Ajalbert, Jean"
36231,London,1878,William Poole,Plimsoll's England. A satire. By Ajax. [In verse.],
36521,Edinburgh,1857,James Nichol,[The Poetical Works of Mark Akenside ... With a biographical sketch of the author (by Dr. Johnson).]: Collections,"Akenside, Mark"
36531,Napoli,1821,,[Hymn to the Naiads.] Alle Najadi. Inno alla Greca ... Recato in verso Italiano da T. J. Mathias,"AKENSIDE, Mark."
36721,London,1897,Bliss & Sands,"Triscombe Stone: a romance of the Quantock Hills, etc","AKERMAN, Portland Board - and HURST (Norman)"
38673,Ἐν Κερκυρᾳ,1891,,Κερκυραϊκα ἀπομνημονευματα. [Edited by I. Delotes.],"ALBANAS, Phriderikos."
38986,London,1827,William Marsh,"Scenes and Occurrences in Albany and Cafferland, South Africa. [By T. Phillips.]",
39670,London,1808,T. & R. Hughes,"Albert and Rosalie, or the Fire King. A grand melodrama, in three acts. [By F. F. Warton. In verse.]",
39775,Plymouth,1868,W. Cann,"The Prince Albert, a poem. [By Joseph Plimsoll.]: Appendix","Albert - Prince Consort of Victoria, Queen of Great Britain"
40021,London,1886,Macmillan & Co.,"The Cruise of Her Majesty's Ship “Bacchante,” 1879-1882. Compiled from the private journals, letters and note-books of Prince Albert Victor and Prince George of Wales, with additions by J. N. Dalton",
40627,Trento,1860,,Annali del principato ecclesiastico di Trento dal 1022 al 1540 compilati sui documenti da F. F. degli Alberti ... reintegrati ... da T. Gar,"ALBERTI, Francesco Felice degli."
40680,Amsterdam,1810,,"De Kaffers aan de zuidkust van Afrika, natuur en geschiedkundig beschreuen. [Translated from the German manuscript by Jan Konijnenburg.]","ALBERTI, Johann Christoph Ludwig."
40976,Heilbronn,1886,,Francisci Albertini Opusculum de mirabilibus novae urbis Romae. Herausgegeben von August Schmarsow,"ALBERTINI, Francesco degli."
41050,Torino,1880,,Alla Nuova Guinea: ciò che ho veduto e ciò che ho fatto. [With illustrations of birds by J. Gould.],"ALBERTIS, Luigi Maria d'."
41096,w Krakowie,1849,,Panowanie Henryka Walezyusza i Stefana Batorego krolów Polskich. Z rękopismów Albertrandego podług wydania Ż. Onacewicza. Z dołączeniem Pamiętników historyi Stefana Batorego dotyczących. [With the preface of Onacewicz.],"ALBERTRANDY, Jan Chrzciciel - Bishop of Zenopolis"
41097,w Krakowie,1860,,[Panowanie Henryka Walezyusza i Stefana Batorego krolów Polskich. Z rękopismów Albertrandego podług wydania Ż. Onacewicza. Z dołączeniem Pamiętników historyi Stefana Batorego dotyczących. [With the preface of Onacewicz.]],"ALBERTRANDY, Jan Chrzciciel - Bishop of Zenopolis"
41601,London,1724,J. Roberts,"Albion; or, the Court of Neptune. A masque. [By Thomas Cooke.]",
41623,London,1772,J. Wilkie,The Albion Princess: a pindaric ode. [By Robert Colvill.],
42862,London,1812,"James Carpenter, etc.","The Geographical and Historical Dictionary of America and the West Indies, containing an entire translation of the Spanish work of ... A. de Alcedo, with large additions ... by G. A. Thompson","ALCEDO, Antonio de."
42904,London,1873,"Smith, Elder & Co.",Alcestis. [A novel. By Blanche Warre Cornish.],
42911,London,1851,Richard Bentley,"Spiritual Alchemy; or, Trials turned to Gold. By the Author of “Hearts in Mortmain,” and “Cornelia” [i.e. Margaret Sandbach]",
43140,London,1835,Richard Bentley,Recollections of an Excursion to the Monasteries of Alcobaça & Batalha. By the author of Vathek [i.e. W. Beckford. With a portrait],
43252,London,1799,C. Dilly,"Poems, &c. &c. [Edited by Joanna Hughes.]","ALCOCK, Mary - Poetical Writer"
45172,Boston,1875,H. L. Shepard & Co.,"History of the United States Marine Corps ... From official reports and other documents, compiled by Captain R. S. Collum","ALDRICH, M. Almy."
45574,London,1867,Hurst & Blackett,"Alec's Bride. By the author of “St. Olave's” [i.e. Eliza Tabor, afterwards Stephenson], etc",
48378,London,1837,Henry Colburn,Narrative of a Voyage of Observation among the Colonies of Western Africa ... and of a campaign in Kaffir-Land ... in 1835 ... Illustrated with maps and plates by Major C. C. Michell,"Alexander, James Edward - Sir"
48384,London,1830,Henry Colburn & Richard Bentley,"Travels to the Seat of War in the East, through Russia and the Crimea, in 1829, etc. [With plates and a map.]","Alexander, James Edward - Sir|ALEXANDER, John Henry - Engineer"
48908,London,1841,J. R. Smith,"A Journey to Beresford Hall, the seat of Charles Cotton Esqre, the celebrated author and angler. [Preceded by a memoir of the author. The dedication signed: J. G.]","ALEXANDER, William - Assistant Keeper of Antiquities, British Museum"
48989,Edinburgh,1884,Privately issued by W. Paterson,"The Earl of Stirling's Register of Royal Letters relative to the affairs of Scotland and Nova Scotia from 1615 to 1635. Edited, with a biographical introduction, by the Rev. Charles Rogers","Stirling, William Alexander - Earl of"
49023,Edinburgh,1880,David Douglas,"[Johnny Gibb of Gushetneuk, in the parish of Pyketillim; with glimpses of the parish politics about A.D. 1843. [By W. Alexander. Reprinted from the 'Aberdeen Free Press.']]","ALEXANDER, William - of the Aberdeen Free Press"
49724,Cambridge,1872,Riverside Press,His Imperial Highness the Grand Duke Alexis in the United States of America during the winter of 1871-72. [By William W. Tucker. With a portrait.],
51061,Wien,1837,,Rückblicke auf Algier und dessen Eroberung ... im Jahre 1830. Von einem Offizier aus dem Gefolge des Marschall grafen Baurmont [i.e. Friedrich von Schwarzenberg]: Appendix,
51064,London,1863,Richard Bentley,Through Algeria. By the author of “Life in Tuscany” [i.e. Mabll Sharman Crawford]: Appendix,
51125,London,1820,Goyder,"Travels in Algeirs, Spain, &c. &c. With a faithful ... account of the Algerines, etc. [By Sophia Barnard.]: Appendix",
51466,Bombay,1884,,"Ali Baba, or the Forty Thieves. A burlesque extravaganza ... Adapted ... by ... E. A. P. Hobday, with ... new songs and music, selected and arranged by ... J. H. Leslie. [The libretto. With illustrations.]",
52264,Paris,1894,,Nos Africains.-La mission Crampel.-La mission Dybowski.-La mission Mizon.-La mission Monteil ... La seconde mission Mizon ... Ouvrage illustré,"ALIS, Harry - pseud. [i.e. Jules Hippolyte Percher.]"
52272,Agen,1887,,"Notice sur le château, les anciens seigneurs et la paroisse de Mauvezin, près Marmande ... Accompagnée de nombreux dessins, etc. [With an introduction by J. P. Tamizey de Larroque.]","ALIS, R. L."
52316,London,1883,W. Blackwood & Sons,"Alison. [A novel.] By the author of “Miss Molly,” etc. [i.e. Beatrice May Butt.]",
52347,Edinburgh,1808,Archibald Constable & Co.,"[A Sermon preached ... the day after the funeral of Sir William Forbes, of Pitsligo, Baronet.]","ALISON, Archibald - Prebendary of Sarum"
52370,Edinburgh,1848,W. Blackwood & Sons,"Atlas to accompany Alison's History of Europe. Constructed and arranged under the direction of Mr. A. K. Johnston, etc. [With supplement.]: History of Europe from the commencement of the French Revolution, etc","ALISON, Archibald - Sir, 1st Bart"
52372,York,1845,A. S. Barnes & Co.,"History of Europe from the commencement of the French Revolution in 1789, to the Restoration of the Bourbons ... Abridged from the last London edition ... by Edward S. Gould. Fourth edition","ALISON, Archibald - Sir, 1st Bart"
52772,Philadelphia,1877,J. B. Lippincott & Co.,All Wrong. A leaf from a drama. [A tale. By Annie M. Griffen.],
52859,London,1807,J. J. Stockdale,"All the Talents' Garland; or, a Few Rockets let off at a celebrated Ministry. [By James Sayers.] ... Second edition",
53231,Haarlem,1874,,"Geschiedenis en beschrijving van Haarlem, van de vroegste tijden tot op onze dagen, door F. Allan, onder medewerking van ... C. Ekama ... A. J. Enschedé .... H. Gerlings ... en C. J. Gonnet","ALLAN, Francis - Leeraar aan's Rijks Kweekschool voor Onderwijzers te Haarlem"
53348,Albany,1867,Joel Munsell,"Military Operations in Eastern Maine and Nova Scotia during the Revolution, chiefly compiled from the journals and letters of Colonel John Allan, with notes and a memoir of Col. John Allan. By Frederic Kidder. [With a map.]","ALLAN, John - of New York"
53627,Boston,1892,Houghton & Mifflin,The Army of Northern Virginia in 1862 ... With an introduction by John C. Ropes. [With maps.],"ALLAN, William - late Lieut.-Col., Second Corps, A.N.V"
53628,Philadelphia,1880,J. B. Lippincott & Co.,"History of the Campaign of Gen. T. J.-Stonewall-Jackson in the Shenandoah Valley of Virginia. From November 4, 1861, to June 17, 1862 ... With ... maps ... by Jed. Hotchkiss","ALLAN, William - late Lieut.-Col., Second Corps, A.N.V"
54811,Kjøbenhavn,1873,,"Breve fra danske Krigsmænd, skrevne til Hjemmet under Felttogene 1848, 1849, 1850. Samlede af C. F. Allen. Udgivne af Chr. Bruun","ALLEN, Carl Ferdinand."
54815,Haderslev,1860,,"Danskhedens Skjæbne i Slesvig, udarbeidet efter Prof. Allen's Værk “Det danske Sprogs Historie i Hertugdømmet Slesvig eller Sønderjylland” ved J. W. Marckmann ... Med et Forord af Prof. Allen og et Sprogkort","ALLEN, Carl Ferdinand."
54819,Copenhague,1878,,"Histoire de Danemark depuis les temps les plus reculés jusqu'à nos jours, avec une bibliographie et des tables généalogiques ... Ouvrage ... traduit d'après la septième édition danoise par E. Beauvois. Complété pour les neuf dernières années du règne de Frédéric VII","ALLEN, Carl Ferdinand."
54820,Kiel,1846,,"Geschichte des Königreiches Dänemark, mit steter Rücksicht auf die innere Entwickelung in Staat und Volk ... Übersetzt ... vermehrt und mit einem Vorwort begleitet von Dr. N. Falck ... Zweite ... vermehrte Auflage","ALLEN, Carl Ferdinand."
54828,Kjøbenhavn,1864,,"De tre nordiske Rigers Historie under Hans, Christiern den Anden, Frederik den Første, Gustav Vasa, Grevefeiden. 1497-1536. [Bd. 5. edited by C. Bruun and F. Krarup.]","ALLEN, Carl Ferdinand."
56580,Baltimore,1822,Franklin Betts,"A History of the American Revolution ... To which are added, the most important resolutions of the Continental Congress, and many of the most important letters of General Washington","ALLEN, Paul - of Philadelphia"
